日本外務省官網記載，中日兩國外相也討論到涵蓋日本產食品進口管制問題在內的雙邊經濟關係。中日兩國外相都同意，不僅是中日間懸而未決的事項，包括區域及國際社會的課題，也將持續密切溝通意見。 ▪【數據圖表】全球新冠肺炎確診突破1600萬大關 逾64萬人不治,Blue
北上廣深被撼動 重慶擠下廣州居GDP第4大城,「北上廣深」這個中國一線城市代名詞被改寫。根據中國新出爐的上半年地方生產毛額（GDP）數字，位居前5名的城市依序為上海、北京、深圳、重慶、廣州，重慶因逆勢成長擠下廣州位居第4。至於省級行政區上半年GDP今天全部出爐。廣東、江蘇、山東、浙江、河南依序位居前5名，排名不變。但與去年同期相較，廣東受武漢肺炎疫情影響跌破人民幣5兆元大關，為4.92兆元，跌幅2.5%；江蘇則逆勢成長0.9%，上升到4.67兆元。綜合中國媒體報導，中國各城市（直轄市、地級市）、各省級行政區上半年的GDP出爐，在各城市方面，前10名依序為上海、北京、深圳、重慶、廣州、蘇州、成都、杭州、南京、天津。其中，上海GDP為1.73兆元，北京1.62兆元，深圳1.26兆元，重慶1.12兆元，廣州1.09兆元，是5個GDP超過1兆元的城市。在上述城市中，上海、北京、廣州、南京、天津受武漢肺炎疫情影響，GDP均較去年同期明顯下滑，其中天津下跌3.9%，北京下跌3.2%，廣州下跌2.7%，上海下跌2.6%，南京下跌1.9%。相形之下，杭州逆勢成長1.5%，重慶、蘇州也成長0.8%，是造成廣州被重慶超越的原因。而中國31個省級行政區的GDP，前10名依序為廣東、江蘇、山東、浙江、河南、四川、福建、湖南、安徽、湖北。頭兩名的廣東、江蘇仍在4兆元以上，但差距縮小；第3名的山東為3.3兆元；浙江為2.9兆元；河南2.56兆元；四川2.21兆元；福建1.99兆元，距2兆元大關極為接近。而屬武漢肺炎疫源地的湖北，上半年GDP較去年同期大減19.3%，排名因此從第7降至第10，也使得福建、湖南、安徽各向前晉升1名。,Blue
中信銀勞工紓困貸款案收件核貸數衝第一 有三大關鍵...,金管會今（29）日舉行「獎勵本國銀行加速辦理紓困振興貸款方案」評比優等銀行表揚典禮，公布第一期辦理紓困貸款績優銀行名單，共有14家銀行受獎表揚，九家公股銀行全入列，民營銀行中信銀行在此次勞工紓困貸款項目收件數、核保數都衝第一，中信銀行在會中分享克服龐大申貸案件負荷的三大關鍵因素。中信銀表示，能在此次勞工紓困貸款的收件數、核保數衝第一，有三大關鍵：一、創新的數位文化、二、快速反應的敏捷團隊、三、智能化的數位能力。中信銀行總經理陳佳文分析， 中國信託在創新的DNA之下，這幾年持續強化敏捷力與數位力的各項基礎建設，並形成公司同仁都能認同的企業文化。勞動部在4月30日開辦勞工紓困貸款，中信銀為了讓客戶能有方便的申貸體驗，領先同業在當天提供QR code，讓客戶在線上申請貸款。但勞動節假期結束後，大量湧進的申貸數量，使同仁的服務量能及資訊系統的承載上限，都受到嚴重衝擊。中信銀於第一時間成立敏捷紓困指揮中心，快速整合跨功能團隊，確定專案目標之後，釐清客戶申請痛點及解決方案，再排定各項工作順序，以系統迭代上線方式來解決問題，每日追蹤成效，即時改善。中信銀表示，紓困貸款從申貸到核保，全以數位化方式處理，一、全數位化的客戶申貸與內部處理流程、二、具有案件分流處理能力的智能化徵審決策引擎、三、能處理大量重複作業的流程機器人。金管會9月底還會評比第二期績優者，這些銀行將享有申設分支機構優先核准、申請業務試辦加速核准等優惠措施。為鼓勵各銀行積極辦理各部會及自行辦理的紓困振興貸款，金管會訂定「獎勵本國銀行加速辦理紓困振興貸款方案」，分別就「金額」、「件數」及「效率」三面向分組進行評比，另外，對配合政府紓困後的振興經濟作為，例如協助振興三倍券發放等，也列入評比加分項目。,Blue
WWF：全球野生老虎數量有起色 仍面臨盜獵威脅,今天是世界老虎日，世界自然基金會（WWF）和印度政府表示，儘管不丹、中國、印度、尼泊爾與俄羅斯5個國家的野生老虎數量有起色，但牠們仍面臨盜獵等主要威脅。目前全球剩不到4000隻野生老虎，其中有70%都棲息在印度，印度等13個國家早在10年前就誓言要提高野生老虎的數量。印度政府2006年進行的第一次全國調查發現，野生老虎數量只有1411隻，但去年公布的調查結果，全國的野生老虎數量增至2967隻。WWF全球老虎生存計畫（Tigers Alive Initiative）負責人柴普曼（Stuart Chapman）今天在紀念世界老虎日的聲明中指出：「從2010年歷史低點後，老虎數量終於在南亞、俄國與中國的許多地區有了顯著成長。」柴普曼表示，對於其他在棲息地中受威脅的物種和數以百萬計依賴這種生態系統的人們來說，不丹、中國、印度、尼泊爾與俄國的野生老虎數量增加是個「大好消息」。但WWF指出，野生老虎仍面臨盜獵和棲地破壞的威脅，同時老虎數量的分布也變得支離破碎，這會增加近親繁殖的風險。WWF還說，東南亞大部分地區已經來到臨界水準，在那裡陷阱危機正使老虎和牠們獵物在內的野生動物走向滅絕。 ▪【數據圖表】全球新冠肺炎確診突破1600萬大關 逾64萬人不治,Blue
新冠肺炎全球1676萬例確診 逾66萬人染疫病故,法新社彙整官方數據顯示，截至格林威治標準時間29日11時（台灣29日晚間7時），全球至少66萬787人死於2019冠狀病毒疾病（COVID-19，新冠肺炎），至少1676萬9080人染疫。自去年12月中國爆發疫情以來，疫情迄今已蔓延全球196個國家及地區，至少955萬5900人目前被認為已經康復。法新社蒐集各國當局和世界衛生組織（WHO）提供的數據做出統計，但上述數字恐怕只反映實際感染總數的一部分，因為許多國家只檢測有症狀或嚴重病例。全球昨天通報新增6307人死亡及24萬4718起確診病例。根據通報數據，新增病逝人數最多的國家依序為美國（1592死）、巴西（921死）及墨西哥（854死）。美國仍是疫情最嚴重國家，累計14萬9260人病故、435萬2304人確診，至少135萬5363人被宣告已康復。其他疫情重災區還包括巴西（8萬8539人喪生、248萬3191人染疫）、英國（4萬5878人喪生、30萬692人染疫）、墨西哥（4萬4876人喪生、40萬2697人染疫）及義大利（3萬5123人喪生、24萬6488人染疫）。依照染疫死亡人數與人口的比例，比利時是死亡率最高的國家，每10萬人就有85人染疫喪命，其次是英國（68人）、西班牙（61人）、義大利（58人）及瑞典（56人）。中國（不含香港、澳門）境內迄今通報8萬4060例確診（昨天迄今新增101死），其中4634人死亡，還有7萬8944人已康復。歐洲累計20萬8919死、311萬6136例確診；拉丁美洲和加勒比海地區累計18萬8718死、452萬7911例確診；美國和加拿大累計15萬8200死、446萬7181例確診；亞洲累計5萬9913死、264萬1771例確診。中東地區累計2萬6334死、112萬3083例確診；非洲累計1萬8496死、87萬5652例確診；大洋洲累計207死、1萬7350例確診。 ▪【數據圖表】全球新冠肺炎確診突破1600萬大關 逾64萬人不治,Blue
菲律賓疫情延燒 政府總負債攀升至5.4兆元,菲律賓新冠肺炎確診數突破8萬5000例，衛生官員坦言醫療系統快無力招架。馬尼拉當局財政支出也隨著疫情攀升，截至6月底，政府總負債達9兆540億披索（約新台幣5兆4000億元）。菲律賓國庫局今天發布新聞稿指出，截至6月底，中央政府未償債務增加到9兆540億披索。與5月底相較，菲國政府未償債務增加1633億披索；與去年底相較，負債增加1兆3227億披索。菲律賓中華銀行（RCBC）首席經濟學家瑞卡弗特（Michael Ricafort）告訴GMA新聞網，馬尼拉當局未償債務攀升原因是「政府在國內和海外借更多錢，以挹注各項2019冠狀病毒疾病（抗疫）方案」。疫情爆發後，亞洲開發銀行（ADB）和世界銀行分別提供菲國政府至少15億美元（約新台幣439億元）和12億美元貸款對抗2019冠狀病毒疾病（COVID-19，新冠肺炎）。截至今天下午4時，菲律賓新冠肺炎總確診數達8萬5486例，其中5萬6528例尚未治癒，已有1962人病逝。有線電視新聞網菲律賓台（CNN Philippines）報導，菲國衛生部副部長維赫利（Maria RosarioVergeire）昨天說，截至26日，菲律賓新冠肺炎專用床位使用率達52.3%，床位占用率進入「警戒範圍」。她表示：「全國而言，我們的醫療系統快要招架不住。我們的醫生、護士和其他在醫院照顧我們的人員會疲乏。因此，籲請大家遵守最起碼的衛生規範。」另一方面，菲國總統杜特蒂（Rodrigo Duterte）27日在國情咨文中說，因承擔不起與中國兵戎相見，他對菲中南海主權爭議束手無策，只能透過外交努力維護菲律賓南海權利。杜特蒂並請求中國國家主席習近平，若中國研發出新型冠狀病毒疫苗，允許菲國優先取得。對此，中國外交部發言人汪文斌昨天正面回應。汪文斌說，中方讚賞杜特蒂對南海問題相關表態，「菲律賓是中國的友好鄰邦，我們願在疫苗方面優先考慮菲方需求」。 ▪【數據圖表】全球新冠肺炎確診突破1600萬大關 逾64萬人不治,Blue
標普：美制裁華為 亞太科技企業恐損失250億美元,評級機構標準普爾29日發表報告指出，美國近期對華為的制裁及限制，估計將使得受評的亞太區科技企業面臨約250億（美元，下同）的收入風險。據路透報導，美國商務部今年5月採取行動，限制華為使用美國技術在海外設計和製造半導體的能力，而去年5月，美國將華為及附屬公司列入「實體名單」，禁止華為在未經美國政府批准的情況下從美國公司購買零組件。標普估算，新的限制將影響包括台積電及中芯國際等代工廠15%到20%的收入，也就是接近70億元，並且也可能對其他亞太區受評科技企業帶來打擊，這些公司與「實體名單」中企業的連繫帶來的間接收入影響達180億元。不過，標普預期，隨著亞太區科技企業適應了華為使用美國技術的限制增加，營運方面將出現劇變，但最終對收入和信貸評級的影響可能溫和。因標普預計，市場對更先進的節點晶片組（例如具有7奈米及5奈米晶體管）的強勁需求，將有助抵消華為對台積電的訂單損失，而大陸客戶轉向大陸供應商採購也將讓中芯國際得益。此外，一旦關鍵零組件用完，華為的重點將可能由高階智慧型手機，轉移至中低階手機和物聯網（IoT）設備；大陸科技公司小米的智慧型手機及物聯網設備在大陸恐怕將面對更大競爭，但同時能獲得海外智慧型手機市場的占比。與此同時，因華為和其他大陸技術公司應對美國限制的挑戰，中國大陸政府可能會增加對這些公司的財務和經營上的支持，形式可能包括注資、補貼、稅收減免、加快監管審批或減少官僚作風等。標普更預期，北京可能會做出一些反制措施以限制美國科技產品在中國大陸銷售，在極端的情況下，美國科技公司將會損失在大陸的一半銷售額。 ▪【數據圖表】全球新冠肺炎確診突破1600萬大關 逾64萬人不治,Blue
擔憂社交媒體操縱政治討論 美、日政界督促限制TikTok,本周二（7月28日），美國共和黨一些資深參議員加大對中資擁有的流行影片應用TikTok的壓力，要求川普政府評估它可能干擾美國大選的風險。,Blue
大陸文化和旅遊部副部長李金早接受審查調查,中共中央紀委國家監委網站29日晚間發佈消息指出，文化和旅遊部黨組副書記、副部長李金早涉嫌嚴重違紀違法，目前正接受中央紀委國家監委紀律審查和監察調查。　　中新社報導，李金早生於1958年1月，湖北仙桃人，中國社會科學院經濟學博士研究生。1984年至1986年在財政部財科所工作，1988年10月至1994年8月在國家計委工作。1994年8月起李金早歷任桂林市副市長、市委副書記、市長。2001年10月起任廣西壯族自治區黨委常委，同年11月兼任桂林市委書記、市長，2008年1月李金早任廣西壯族自治區黨委常委、自治區政府黨組副書記、常務副主席。2011年10月任商務部副部長、黨組成員。2014年10月，任國家旅遊局黨組書記、局長。2018年3月，任文化和旅遊部黨組副書記、副部長。,Blue
公股銀行招募香港金融人才 工會質疑要求先評估,對6家泛公股銀行將專案招募香港金融人才，全金聯今天提出3點意見，質疑如何避免有特定背景人士假工作之名，取得銀行機敏資料，又是否將排擠本國人工作權，要求應先詳細評估。對媒體報導，因應港區國安法實施，6家泛公股銀行將提出香港金融人才招募專案，為政府援助港人方案之一，財政部也已多次邀集公股銀行開會，粗估預計招募150人，全國金融業工會聯合總會（全金聯）今天提出3點質疑。全金聯表示，首先，建議延攬對象，應該是要國際大型金融機構，且要避免有特定背景的香港人士假工作之名，實際滲透我國公股銀行內部，取得企業經營政策或機敏性的資金業務等資料，徒增經營風險及國家安全疑慮。全金聯提醒，其次，目前合庫、兆豐、一銀、華銀、彰銀、台企銀等6家公股銀行皆有簽訂團體協約，未經工會同意，於台灣地區不得僱用非本國勞工，同時質疑香港金融人才招募專案，是否會排擠本國人工作權或有為特定人士量身訂做之嫌。全金聯認為，報載泛公股銀行目前開出需求集中在國際聯貸及跨境融資業務、高淨值財富管理業務、私人銀行業務行銷規劃、新金融商品設計開發、金融科技與資安專業人員、國際洗錢防制專業人員等，這類需求是否一定要靠聘雇非本國勞工才能滿足。全金聯指出，再者，政府大舉爭取香港金融人士來台灣任職，並要公股銀行提供各項津貼、福利，但是否有先做好效益評估，且台灣金融法規與香港大相逕庭，如何期待藉由進用香港人才，就能達成政策需求，使台灣金融產業躍升成為國際金融中心。全金聯重申，政府提出援助港人的行動規畫，相關主管機關應先詳細評估包括國家安全、本國勞工權益及政策目標可行性等事項，不能粗糙草率為之，以免日後增生無謂問題。對此，財政部官員表示，針對吸引香港金融人才的作法，一定會先跟工會說明溝通，取得共識，攬才時一定會從背景資料去篩選排除，不可能讓有中國背景者，假工作之名接觸機密敏感資訊。財政部官員指出，香港為全球金融中心，台灣金融相較有一些較弱環節，在不影響國內勞工權益下，希望能引進香港金融人才，協助補足強化金融業發展。,Blue
碳交易制度露曙光 環保署擬納290家排碳大戶,溫室氣體減量及管理法通過五年，當初設有「溫室氣體總量管制及排放交易制度」（碳交易制度），原規畫最快去年實施卻沒動靜，法規形同虛設。近日露出曙光，環保署正緊鑼密鼓修正溫管法，同時盤點出每年排碳2.5萬公噸以上的290家「排碳大戶」，如台電、中油、中鋼等，將評估納入碳交易對象。氣候變遷加劇，歐盟多年前就實施碳交易，設置碳排總量管制，再分配各企業排放額度，實際碳排超過額度的企業，可向碳排低於額度的企業購買碳權，藉此刺激企業減碳。南韓近年也實施碳交易，但市場尚不活絡，中國則將發電業納入主要管制，未限制所有業別。環保署環管處副處長黃偉鳴表示，年底將提出溫管法修法草案，其中一項重點是授權各部會自行訂定溫室氣體管制工具。外界過去期待溫管法加強約束各部會減碳，但立法不易直接指定單位負責特定工作，因此希望透過修法，讓各部會依業務增加彈性管制工具，提升減碳效率。至於外界關注的碳交易制度，黃偉鳴指出，會配合溫管法修法時程，開始與外界溝通碳交易實施可行性。目前考慮參考歐盟經驗，將每年排碳量超過2.5萬公噸的企業納入碳交易對象，經盤點有290家「排碳大戶」，包括台電、中鋼、中油等，已掌握這290家企業近四年申報資料，確認符合管制資格。黃偉鳴強調，除了碳交易，國際上也會要求產業提高效能、加嚴排放標準，須因地制宜，近期將與外界討論各種減碳作法。經濟部次長曾文生日前示警，歐盟將通過碳關稅，一旦實施將對台灣產業造成衝擊。「碳關稅」指的是針對高排碳國家產品額外課稅，目前我國並未建立碳交易、碳稅或碳費相關制度，不利未來出口歐盟。學者私下感嘆，台灣很早就開始討論碳交易，但遲遲未實施，現在才面臨碳關稅威脅。據了解，環保署2015年修正溫管法，認為碳交易可降低碳排，但修法後又有聲音批評將造成「大者恆大」，資本雄厚的廠商可買進更多碳權，將排碳汙染合法化，反而形成嚴重汙染熱點。為避免大者恆大，環保署內部也思考過，取前20大碳排企業為碳交易對象，但若家數過少，彼此是否願意買賣相當值得存疑，碳交易制度不斷延宕至今。,Blue
大陸外交部：「中美接觸失敗論」不尊重歷史與事實,美國國務卿龐培歐近日發表對北京政策演講，指出美國盲目與大陸接觸的政策已經失敗，對此大陸外交部發言人汪文斌今日表示，「中美接觸失敗論」不尊重歷史，且不符合事實。據陸媒澎湃新聞報導，今日大陸外交部例行記者會上有記者詢問汪文斌如何看待「中美接觸失敗論」？汪文斌以三點作為回應。首先，汪文斌說，「中美接觸失敗論」不尊重歷史、不符合事實。中美恢復交往和建交近50年來，中美雙邊各領域交流和合作不斷拓展和深化，兩國人民從中受益良多。汪文斌說，據統計，中美經貿關係支撐美國國內260萬個就業崗位，超過了7.25萬家美國企業在中國大陸投資興業。在多邊層面，從處理地區熱點問題到應對反恐、防擴散等全球性議題，中美合作辦成了許多有利於兩國也有利於世界的大事。第二，汪文斌表示，「美國改造中國論」注定會失敗。每個國家所走的道路都是基於各自的文化傳統和歷史積澱，應該由本國人民來決定，任何勢力都沒有資格去否定其他國家選擇的道路。世界是豐富多彩的，中美儘管社會制度不同，但是完全可以做到並行不悖，和平共存。最後，汪文斌說，「龐培歐等人出於一己的政治需要，否定過去四十多年來美國以往歷屆政府的對華政策以及在對華關係上取得的進展，試圖重新挑起意識形態的對立，這即便在美國國內也是不得人心」。連日來，美國的許多前政要、學者、媒體對龐培歐的這次講話紛紛提出了質疑和批評。汪文斌指出，中美關係攸關兩國人民的福祉和世界的和平穩定，陸方敦促龐培歐等人摒棄陳舊過時的冷戰思維和意識形態偏見，正確看待中國大陸和中美關係，立即停止損害陸方利益、破壞中美關係的言行，為兩國關係重新回到正常發展軌道創造必要條件。 ▪【數據圖表】全球新冠肺炎確診突破1600萬大關 逾64萬人不治,Blue
核融合發電 科學家在法國組裝人造太陽,獲得官方核准14年後，科學家28日開始在法國南部組裝一部機器，尋求確認核融合是否能成為地球上安全又可靠的能源來源。多國參與的突破性國際熱核融合實驗反應爐計畫（International ThermonuclearExperimental ReactorITER），來自世界各地的零組件近幾個月運抵法國南部小鎮杜蘭斯河畔聖保羅（Saint-Paul-les-Durance）。現在必須煞費苦心組裝這些零組件，以完成這項被大肆宣傳為「全球最大拼圖」的ITER。這座實驗工場的目的是為了證明，核融合能大量、安全且商業化規模發電。參與ITER的35國共同發表聲明說：「核融合提供清潔、可靠且沒有碳排放的能源。」這些國家包括歐盟27個成員國、英國、瑞士、印度、日本、韓國、俄羅斯、美國與中國。此外，核融合的燃料可在海水與鋰金屬取得，海水與鋰相當豐富，足以供應人類達數百萬年。聲明表示，鳳梨般大小的這類燃料，就相當於1萬噸煤。ITER將由約100萬個零組件建構而成，預定2025年12月展開初步實驗。這個人造太陽設施目的是要產生約500個百萬瓦熱能，倘若持續運轉，可轉換成約200個百萬瓦電能，足以提供電力給大約20萬戶家庭。 ▪【數據圖表】全球新冠肺炎確診突破1600萬大關 逾64萬人不治,Blue
李克強召開國務院常務會議：深化服務貿易創新發展試點,大陸為了提振下半年經濟，國務院總理李克強29日表示，將擴大開放穩外貿穩外資，決定深化服務貿易創新發展試點；推出支持農民工就業創業新舉措施。中國政府網公告，李克強昨天召開國務院常務會議強調，要聚焦穩住外貿主體、穩住產業鏈供應鏈，一是支持外貿企業增強抗風險能力。推廣「信保+擔保」，為外貿企業融資提供增信支持。二是鼓勵中西部、東北地區發揮優勢，承接勞動密集型外貿產業。支持發展跨境電商、海外倉、外貿綜合服務企業等新業態。三是完善吸引外資政策環境。對重點外資項目一視同仁的保障。再貸款再貼現專項額度、進出口銀行新增貸款規模等同等支持外資企業。四是發揮服務貿易對穩外貿穩外資的效果。結合區域發展戰略，將服務貿易創新發展試點擴大到21個省地區，包括發展跨境商業醫療保險、推進中外合作辦學、在常態化防控下加強旅遊和體育國際合作等。此外，支持農民工就業創業為重要工作內容。會議指出四大措施，一要拓寬就業渠道，穩定城鎮常住農民工就業。大力發展生活服務業、勞動密集型產業，對吸納農民工就業多的給予更大政策激勵。二要支持農民工就地就近就業。農村水利等基礎設施建設、災後恢復重建等，為農民工就業創造更多機會。三要以創業帶動就業。對農民工首次創業且正常經營六個月以上的，可先行申領一次性創業補貼的一半資金。四要擴大幫扶力度，優先保障貧困勞動力穩崗就業。對符合條件的農民工等未參保失業人員，未納入低保範圍的，由務工地或常住地發放一次性臨時救助金。會議表示，統籌推進疫情防控和經濟社會發展，提高新冠病毒檢測能力是關鍵性手段。要調動各方力量，加快檢測時間短、靈敏度高、操作簡便的產品研發上市。各有關方面要及時加強資金等保障。,Blue
中國駭客傳再出擊 疑為9月中梵會談刺探情報,美國網路安全諮詢公司「記錄未來」今天表示，與中國政府有關的駭客入侵梵蒂岡電腦網路，包括梵蒂岡駐香港代表辦公室。這項攻擊疑似是為在中梵9月展開重要會談前刺探情報。路透社報導，梵蒂岡與中國於2018年簽署主教任命臨時協議，這項協議具里程碑意義，使得雙方關係趨於穩定，雙方預計於9月舉行會談，針對延長協議、主教任命與教會地位等議題進行協商。「記錄未來」（Recorded Future）發布報告指出，這些駭客從5月開始攻擊，目標鎖定梵蒂岡及香港天主教教區，包括梵蒂岡駐港代辦何明哲蒙席（Msgr.Javier Herrera Corona）辦公室，他被視為教宗方濟各（Pope Francis）在中國的實質代表。報告顯示，駭客的目標包括香港教區及梵蒂岡間通訊，使用的工具和手法與中國支持的駭客團體相似。梵蒂岡的發言人對此事尚無評論。針對上述報告，中國外交部發言人汪文斌今天在北京的每日例行記者會上回應，中國是網路安全的「堅定捍衛者」。在調查網路安全事件時，需要充分證據而非推測。在這份駭客報告之前，中梵外長今年早些時候曾在德國進行極其罕見的會議，標誌著雙方數十年來的最高層級官方會晤。