政治人物為何「修修臉」？有人愛雙眼回春 有人喜割肉美白,國民黨立院黨團批評蔡英文總統酬庸陳菊，監委名單一片綠油油，日前在立法院抗爭與民進黨立委爆發全武行，不少立委都因此掛彩，不是撞破頭就是割破手，手腳擦挫傷等甚至送醫驗傷。原來立委不只是要比政績、地方服務，還要比拳腳功夫，此外也有不少立委為了選舉或是在支持者面前呈現最好的一面，甚至不惜花錢做醫美，讓「修修臉」成為另一種風潮。眼瞼手術護視力 馬英九順便去眼袋現年70歲的前總統馬英九，日前現身國民黨革實院青年活動，罕見戴墨鏡出席，媒體靠近一看，發現馬英九眼睛腫腫的，質疑他是不是去割雙眼皮，遭馬回酸：「你說我以前是單眼皮嗎？不是。」會員專屬內容立即登入！全年暢讀專屬報導加入會員登入閱讀快體驗，無廣告干擾的暢讀空間 ,blue
國民參審立法／趕鴨上架 淪盲人摸象,立法院臨時會本周處理《國民法官法草案》。依民進黨席次絕對優勢，加以綠委如「力委」，各個驍勇善戰允文允武，只有不為也，沒有不能也。所以如同陳菊監委同意案，執政黨法案想過就過，不想過就放你一馬。國民法官法爭議多高，後遺症多少，光看民間司改會疑慮及在野杯葛態度，其制度不夠完善可略知一二。筆者擔心的是專業素質參差不齊的國民法官搭配正宗法官，正規雜牌軍烏合之眾，這能打仗嗎？審判硃筆能侵害財產權，可剝奪人身自由，甚且定人生死，茲事體大焉得不慎！國民法官係人民對司法信任低應運而生，著眼於矯正恐龍法官烏龍裁判而設，立意甚佳，只是叫瞎子去輔助弱視，豈不淪為盲人摸象！按草案所定，國民有依法擔任國民法官參審之權利及義務，易言之，此差事如國民教育具強制性，被趕鴨子上架的臨時法官，唯有硬著頭皮「走馬上任」。外行人做極具專業化的事，恐聽審像鴨子聽雷，有聽沒懂，參酌意見無異問道於盲，來自各地各行各業的各形各色人，對刑案見解難保不各懷鬼胎，法官三人加國民法官六人，終局評議萬一一人一把號怎麼辦？臨時組合的國民法官角色是紅花或純綠葉陪襯？紅花不可能，因為法院得隨時依職權或依聲請裁定不行國民參與審判，形成虛晃一招；該陪襯綠葉豈不是成提升司法透明度、反映國民正當法律感情、增進國民對司法瞭解信賴、彰顯國民主權理念立法旨意背書之橡皮圖章？少年刑案及毒品案外最輕本刑七年以上重罪，還有致人於死故意犯，經檢察官起訴且由地院行第一審管轄，才屬國民參審案件。所謂隔行如隔山，突然通知一名路人上法庭參審，審判高度專業，法官養成期間僅次醫生，某些公務員或因職業特殊需求，例如警察、法警及監所管理員，須為它們舉辦特考且特用，應考資格也條件限制或作特別要求，則法曹斷訟更該嚴謹不兒戲；沒道理因法官被譏恐龍無腦，被批看顏色不看事證的變色龍，就找社會人士攪和。涉及刑罰，強迫凡民彆扭披法袍審判桌正襟危坐，什麼都不懂也沒意願卻幸運中獎，行禮如儀後承擔「冤枉好人」業障，人民參與審判評議根本徒具形式缺乏實質意義。 ,blue
【重磅快評】蔡總統，你知道蘇嘉全又吃了什麼？,蔡總統才說要用行動證明「民進黨全面執政必貪腐」的劇本不會成真，立馬就有新片上檔。小英愛將蘇嘉全，帶著捲入淘空上市公司的姪子蘇震清，以國會議長身分拉上國營事業，隨同民間業者赴印尼作生意。根據外交部駐印尼代表處密電指出，「國營事業已被若干中間人操控，企圖將政府部會與外館排除，以遂個別私利」，蔡總統能不能老實告訴人民，這回蘇家又吃了什麼？院長「私下新南向」，涉及「損害我國外貿與外交整體利益」，被駐印尼代表處拍密電回部，不料公文由外交部轉到經濟部，又被圈成「密件」，和蘇嘉全外甥吃唐榮鋼鐵的弊案一樣，被國家隊吃案。這齣賣台疑案從國會議長、外交部到經濟部與國營事業，全都是蔡政府自己人，不知新任的監察院長陳菊怎麼看這件事，那些繫著綠裙帶綁飯碗的監委是否會自動調查，真令人好奇。這家牽頭業者「揚運國際」是知名人力仲介，其關係企業慶圓國際從事印尼工業區代理。蔡政府上台時，積極配合新南向政策，主攻印尼商機，2016年底邀請印尼首大集團之一M.N.C來台接觸政府部門，有「印尼川普」稱號的集團執行長陳明立拜會新任國會議長蘇嘉全，蘇家叔姪在院長官邸設宴款待。隔年年初，業者又引進另一集團BOSOWA來台，重頭戲還是赴立院交流，有如把蘇嘉全當門神來拜。業者這回鎖定農業項目，要將台灣農業技術引至印尼，提高農產量，解決緊張的糧食自給問題。外交部密函提到，2017年11月台糖砂糖事業部執行長左希軍率團訪印，在揚運國際安排下，刻意繞過外交部會晤農業部長安南。事實上，印尼準備逐年取消玉米和黃豆進口配額，揚運看好市場需求，找到印尼背景強大的集團供地，再由台糖提供技術，準備展開玉米、稻米大面積種植計畫，因此早在2016年底就已安排台糖執行長訪印。這家人力仲介業者看好曾任農委會主委的蘇嘉全，提前部署蘇家叔姪前進新南向。若真能促進台印實質關係，自然是功在社稷，不過根據外交部密電看來，蘇家又是背著政府搞家族事業。蘇家打著小英愛將名號，為所欲為，未必是總統默許；但經濟部在沈榮津時代，對於打著國王人馬旗號者涉弊，自有一套滅案SOP，甚至還效行教育部處理蔡總統升等教授文件的方式，這是出自總統府的防火牆規格嗎？蔡總統說「清廉勤政愛鄉土」是民進黨不變價值，看看行政部門把弊案藏在國家機密裡，司法又是「大菊為重，碧仲就輕」的辦案標準，更別提監察院早已辦藍不辦綠，難怪總統說「貪腐劇本不會成真」。蔡政府以為不查就沒弊案，但人民不是笨蛋，看到總統府連出兩個問題秘書長，誰都知道「物必自腐而蟲生」的道理。 ,blue
肚頂背「不會懷孕不算性騷擾」 范雲告陳雪生求償50萬,監察院人事案在立法院引起紛爭，日前為阻止監察院長被提名人陳菊到立院備詢，藍綠發生衝突，民進黨立委范雲指控國民黨立委陳雪生用肚子頂她的後背構成性騷擾，陳則回應「用肚子不會懷孕，所以不是性騷擾」；范雲今到台北地方法院提告，要求陳雪生賠償50萬元，並會向台北市政府社會局提出性騷擾申訴。范雲認為陳雪生和國民黨事後嬉鬧嘲笑回應，至今未誠心道歉，她和台灣婦女團體全國聯合會、台灣女人連線、勵馨基金會等婦女團體，及立委林楚茵、林宜瑾、律師賴芳玉、施雅馨一同到台北地方法院提出民事訴訟，也將依性騷擾防治法提出申訴。范雲說，她7月14日第一位到主席台和國民黨立委僵持，當時她背後沒有人，現場也不擁擠，她明顯感覺到有人觸碰下背部，轉頭一看是陳雪生用肚子在頂她，當下她也反應「你這樣子很噁心耶，這樣已經構成性騷擾」，在場好幾位委員都有聽到，沒想到陳雪生不但沒有表達歉意，在緩慢離開的過程中還說「不會懷孕就不算性騷擾」，除非能夠證明他的行為能懷孕才算性騷擾。她向陳雪生回應「你這樣講很糟糕，國民黨委員怎麼這麼沒有性別平等意識」，國民黨應該做好性別平等教育，蔣萬安當時也在主席台上，但他默不做聲。范雲說，如果長期從事婦女、性別平等運動女性委員的抗議，國民黨都可以不理會，如何讓更多弱勢的女性為自己身體尊嚴發聲？她說，很多網友轉貼臉書文章稱陳雪生是噁男、電車癡漢，陳雪生還反嗆她「我沒有那麼飢渴，不要往臉上貼金」，國民黨其他立委說她當天嬉皮笑臉，一副很爽的樣子；立委陳玉珍叫她不要利用女性性別優勢，「這一連串羞辱被害者是二度傷害」。范雲指出，她今天站出來提告，是希望陳雪生學到一課，也希望國民黨團、主席江啟臣可以嚴正正視國民黨內部缺乏性別平等教育，充斥性騷擾文化，也希望受害者不要畏懼二次傷害，一定要為自己發聲。律師賴芳玉指出，「性別平等」在台灣講了多年，但在國會殿堂卻做不到，這是很反諷的，因為目前立法院有「立法院工作場所性騷擾防治及申訴處理要點」及「立法院性騷擾防治申訴及 調查處理要點」，但立委不是立法院員工，不適用這兩個要點。她說，從蘇嘉全擔任立法院院長，到今日游錫堃擔任院長，均有人提案修法，但如今仍無法針對立委行為法、議事規則等相關規定來處置，讓立委行使立法權卻無法針對自身受到的性騷擾、性歧視申訴，確實在法制、性別倡議上大打折扣。 ,blue
警察人事的仙拚仙,蘇貞昌藉故怒拔台南、高雄兩位警察局長的新聞，在立法院因陳菊人事而藍綠大戰後，彷如船過水無痕，但其中引發的問題，真能這樣任其消逝？蘇貞昌用轄區發生槍擊案的理由撤換六都治安評鑑第一名的警察局長下台，不僅聞所未聞，也不合邏輯。連台南市長黃偉哲都忍不住說了公道話：「如果用這一標準換人，其他五都直轄市警察局長不知換了幾輪！」因為治安良窳關係到民眾生命財產安全，在現今改造手槍氾濫的台灣，如果單一槍擊案就可以撤換警察局長、分局長，真會讓全國警察首長都只能看天吃飯，喔，錯了，看黑道的臉色吃飯！警察不只看黑道臉色，也要看政黨派系的臉色！有人以西遊記來形容台灣的警察人事，警政署長宛如孫悟空般的神通廣大，但不論再怎麼神通，背後一定有一尊靠山，這尊靠山才是孫悟空過關斬將、收妖降魔的最大法寶，而這尊靠山就是掌握國家機器的最終權力者－總統，從過去的李登輝、陳水扁和馬英九執政時，都可以看到這樣的權力組合。蔡英文執政後，花了絕大心力扮演三軍統帥，鮮少干預警察，警政首長人事權旁落；目前的警察人事大都靠執政黨中央、地方首長或是掌握媒體的大亨們在「喬」。警察人事的靠山，早已從西遊記裡地位最崇高的太上老君、玉皇大帝，移轉到權力第二、第三層的觀世音菩薩、彌勒佛、太白金星等。也就是說，當今的警察人事早已是「仙拚仙」的年代，孫悟空必須與豬八戒、沙悟淨同台較量，在唐三藏的眼中，不管孫悟空能力再強，戴上緊箍的才是好徒兒，聽話的才是好部屬。當警政署長的權力靠山不是來自至尊時，警察的人事通常會出現大亂鬥，各顯神通，各找靠山。每當人事發布之際，爆料、黑函、民代推薦函滿天飛，形成特殊的警察文化，憂讒畏譏的長官，深怕人事發布得罪人，寧可不發布，也不願自找麻煩，反而加深同仁間猜忌疑慮，打擊士氣。警察界裡常聽到的順口溜：「長官要用你有一萬個理由，不用你也有一萬個理由」、「朝中無人莫做官」、「有關係、沒關係；沒關係、有關係」，這些官場現形記，恰恰說明了警察人事的「關係」，才是「實力」的靠山。警政學者主張警察人事必須遠離政治干擾，並提出日本國家公安委員會做為藍圖，但是橘逾淮而為枳，看看我們的獨立機關如中選會、監察院、ＮＣＣ、促轉會等，最近的表現是否合憲即可預知。如果這套制度引進台灣，可以獨立於政治之外、不落入政黨精算嗎？筆者以為，由於警察首長的任命權力來自中央或地方民意首長，各國的警察人事制度均很難擺脫政治的影響，但可以減少政治的影響範圍。其關鍵，在於當權者對於警察人事的自我克制，讓警察的人事依其專業超然作業，不管是過去西遊記的權力靠山，還是國家公安委員會的制度，必須要當權者自我節制，才能不必仙拚仙，群魔亂舞，把長治久安拚掉了！ ,blue
藍質疑蔡總統：是憲法時刻 還是毀憲時刻,蔡英文總統盼在野黨一起珍惜「憲法時刻」，啟動憲改。國民黨主席江啟臣昨天質疑是憲法時刻，還是「毀憲時刻」？他呼籲蔡總統，伸張主權對外捍衛南海、東海主權，才是她該做的工作，不要對於立院修憲問題指指點點，將行政的大手伸入人民的立法院。江啟臣批評民進黨，上周不惜違法作票、打人見血也要通過監院陳菊人事案，昨天又高談闊論要廢考監，前後矛盾的邏輯，讓民眾感覺政府陷入「人格分裂」；唯一說得通的理由，就是幫陳菊這位民進黨大姐大做好「安排」，有個「位子」。江啟臣詢問「蔡主席」，是真心的想推動十八歲公民權及廢考監，還是假借十八歲公民權及廢考監，模糊酬庸提名與其他憲政問題的焦點？蔡主席是真心的服膺「中華民國憲法」嗎？還是假借修憲時刻，從修憲變毀憲，再從毀憲變台獨制憲？是真心的希望台灣人民尊重信賴司法，還是嘴巴上說團結台灣，實際上卻放任貪汙犯趴趴走，羞辱司法，羞辱台灣人民？江啟臣質疑，蔡英文說的是憲法時刻還是毀憲時刻？ 是團結台灣還是分裂社會？國民黨希望民進黨能真正謙卑的傾聽民意，倒行逆施、一意孤行、漠視民意，人民很快就會收回對於民進黨執政的信任。國民黨立法院黨團書記長蔣萬安昨天表示，黨中央會整合修憲議題，很快就會邀集專家學者和民間團體討論。黨團首席副書記長林奕華說，國民黨團三月時就呼籲盡速組修憲委員會，這次的臨時會召開前，國民黨團和民眾黨團共同提出的臨時會議程中，也包括盡速完成修憲委員會組成的決議案，但後來民進黨全部否決，「要修憲就盡快成立修憲委員會」。民眾黨團總召賴香伶表示，民眾黨一直以來都希望加快修憲腳步，希望立法院盡快成立修憲委員會。 ,blue
聯合報社論╱大內宣也遮不住蔡政府的吃相和失能,監察院公布總統大選政治獻金收支明細，朝野一再創高的選舉帳冊裡，宣傳支出已成重中之重，而且趨於表演化，形塑候選人的娛樂性多於政策溝通。競選連任的蔡總統已有國政舞台，不但把國政行程跑成選舉行程，還有「國家選舉隊」開道陪跑，卻仍砸重金買人氣。諷刺的是，隨著一連串用人唯私、吃相難看，以及治國失能等政治素顏走光，總統精心鍍金的形象已開始掉漆。蔡英文三次參選總統都不計重本經營文宣，這次宣傳經費占總支出逾五成，並極發揮空戰技能，從網軍到自媒體、社群平台全數收編。開出史上最高得票數之後，她更將這套戰技擴及政府部門，於是出現史上最愛演的閣揆、最多的網路小編和隨時更新的精美哏圖。文宣機器鋪天蓋地，卻仍遮不住府院黨各種失能失態。從國家機器護航高雄市長罷免，國家通傳會委員提名唯綠，針對打壓特定媒體因事用人，到監院人事綠營一家親、提名官箴諸多爭議的陳菊出掌監院，都讓外界看見台灣民主恐怕難有公平選舉、獨立監督、權力制衡的常態。蔡總統曾承諾，要留下一個更好的國家，沒想到她所謂的「更好」，竟是黨國體制復辟，意圖重回只能選擇服從的威權時代。大選時，綠營透過文宣編織「小英率隊抗中護台」的腳本，蔡總統成了英勇辣台妹。但劇本在選前就已漸露馬腳：民選總統開始效法中共，修法重罰打造威權政府。更讓人憂心的，是民進黨執政也走上中共「國進民退」路線，對岸是政經戰略考量，蔡政府則是逕行吞併人民財產，強制收歸國有。蔡政府第一任四年揮舞轉型正義大旗，揮刀砍國民黨黨產，更草率認定婦聯會、救總等為「附隨組織」，沒收財產。第二任剛開始，又強制將農田水利會財產收歸國有、人事官派，甚至遙指鄉鎮市長改官派。蔡政府所為，其實無關公義，而是強行掠奪。綠營指控國民黨戒嚴時期取得黨產有違正義，必須返還充公；但民進黨各派系遍據國營事業要津，酬庸一表三千里。以總統愛將蘇嘉全外甥全家一貫作業包標案為例，公股事業不僅變黨營甚至家族化，堪稱「青出於藍，更勝於藍」。綠委誣指基層選舉為黑金溫床，要直接沒收地方民主改官派；又在文官制度動手腳，讓機要可走巧門出任公職。這是以官為樁，搶黑金煉綠金。蔡總統極重視形象，拿下文化總會安置近身人員，默許親信「夥伴」開公司，包辦重要選舉與特定政策文宣，取得國家資源之餘，樹立業界主流和政治尺規才是重點。小英處心積慮美化執政形象，殊不知她所領導的團隊和御用化妝師，已成破壞體制與官箴的負面示範。大內宣愈砸錢，愈凸顯執政團隊的弱點。蔡政府對民間批評毫無反省，卻要求黨內研究「鋼鐵韓粉現象」，用心經營網路社群；網路有批評的聲音，就用《社維法》送辦。上位者走火入魔，無怪百官只重網路聲量，無心施政。而大內宣最嚴重後遺症，就是治理失能。上一季蘇內閣高唱防疫有成，結果經濟衰退遠甚疫情。失業率不斷攀高，只重口罩無視百業荒蕪、玩殘振興券的經濟部長沈榮津，卻高升副揆；交通部長林佳龍撒錢救觀光無效，便酸業者「沒競爭力就退場」。在這種情況下，傳產和服務業災情慘重，蘇揆抹白老臉到處作秀，就算拚經濟、救產業嗎？蘇內閣發區區兩千元振興券還要為難人民，說穿就是折騰，顯示政府缺乏膽識與創意。八一七萬票養大綠營胃口，大內宣不僅是執政黨吃相難看及治國失能的遮羞布，更矇蔽人民對國家內外處境的認知。五年前，蔡英文面對的選戰考驗就是經濟與兩岸關係，如今問題愈發惡化，而那個曾附著在扁家的貪腐形象，甚至跟著皇親國戚與派系分贓回來了。 ,blue
蔡英文籲在野黨珍惜憲法時刻廢考監 江啟臣：毀憲時刻,蔡英文總統致詞時今天呼籲，在野黨珍惜「憲法時刻」，對於朝野有共識的18歲公民權及廢考監都可以先做。對此，國民黨主席江啟臣質疑是憲法時刻還是「毀憲時刻」？他呼籲蔡總統，伸張主權對外捍衛南海、東海主權，才是她該做的工作，不要對於立院修憲問題指指點點，將行政的大手伸入人民的立法院。江啟臣批評民進黨，前天不惜違法作票、打人見血也要通過監院陳菊人事案，今天又高談闊論要廢考監，前後矛盾的邏輯，讓民眾感覺政府陷入「人格分裂」。唯一說得通的理由就是幫陳菊這位民進黨大姐大做好「安排」，有個「位子」。江啟臣詢問「蔡主席」，是真心的想推動18歲公民權及廢考監，還是假借18歲公民權及廢考監，模糊酬庸提名與其他憲政問題的焦點？蔡主席是真心的服膺「中華民國憲法」嗎？還是假借修憲時刻，從修憲變毀憲，再從毀憲變台獨制憲？是真心的希望台灣人民尊重信賴司法，還是嘴巴上說團結台灣，實際上卻放任貪污犯趴趴走，羞辱司法，羞辱台灣人民？江啟臣質疑，蔡英文說的是憲法時刻還是毀憲時刻？ 是團結台灣還是分裂社會？江啟臣說，國民黨希望民進黨能真正謙卑的傾聽民意，倒行逆施、一意孤行、漠視民意，人民很快就會收回對於民進黨執政的信任。江啟臣強調，不論是南海或是東海主權爭議，國民黨一貫主張只有主權在我，才能有擱置爭議、和平互惠、共同開發的空間。但是面對日本對於頭城釣魚台的更名，美國南海海洋主張立場，都是對我國主權的實質侵害。民進黨政府或是默不做聲，甚至表達委婉歡迎，對外立場軟弱，哪來的辣台妹風範？此外，江啟臣也提及前總統陳水扁出現民進黨全代會非常弔詭。一個保外就醫，被矯正單位以及民進黨團要求要節制的受刑人，大辣辣的出席中執評委會議行使投票權，公然踐踏司法尊嚴。江啟臣也提醒蔡英文總統，民進黨已經完全執政第五年，不知道是否還記得30年前10月13日，民進黨第五屆全代會通過的「台獨黨綱」。民進黨已經是執政黨、多數黨，不需要拐彎抹角的在「台灣正名」上打擦邊球，搞大內宣。國民黨不樂見，但鼓勵蔡總統拿出勇氣直球對決，做一個自己心目中的辣台妹。國民黨主席江啟臣批評民進黨，前天不惜違法作票、打人見血也要通過監院陳菊人事案，今天又高談闊論要廢考監。圖／取自江起臣臉書 ,blue
【綠全代會風雲3】海董受挫只奪1席中常委 湧言會短期難再大幅進展,民進黨全代會重頭戲中常委等黨職改選結果出爐，中常委方面，新潮流搶下3席，仍是最大贏家，泛英系與正國會分別拿下2席，蘇系1席，選前由三立「海董」林崑海領軍、來勢洶洶的湧言會（海派），最終維持平盤取得1席，綠色友誼連線守住1席。新一屆中常會呈現「新蘇」與「非新蘇」各占半數的權力結構。蔡回任黨魁後首次全代會 派系積極備戰,blue
游錫堃：朝野有公民複決綁大選共識 2022年底有機會修憲,立法院長游錫堃今天表示，朝野對於18歲公民權與廢除考試院、監察院都有高度共識；關於未來修憲案，朝野四黨都有公民複決綁大選共識，若在2022年11月縣市長選舉併同辦理，比較有機會通過。游錫堃今出席第14屆「2020台灣UN青年研習營」專題演講，會前受訪時回應了修憲，他也提到，上會期朝野協商，已同意在第二會期討論成立修憲委員會，應不需要另外召開臨時會。對於下周臨時會議程將要處理「國民參與刑事審判法」草案，游錫堃表示，他會再邀朝野黨團來協商，希望國會能透過協商互相溝通，若真的討論不成，才考慮表決，他不願意看到再有衝突情況發生。他說，立法院是民意最高殿堂，各個委員都應該成為全民典範。上週監察院人事同意權審查過程中，看到許多委員的行為，對教育尤有影響，很多年輕朋友在社會化中，需要有更多法治、民主信仰時，國會卻做了不良的示範。對於國民黨團指控7月16日民進黨立委陳瑩不在場，有人代按表決器，質疑立法院作票。游錫堃回批，子虛烏有，透過直播都可看得出來有沒有作票，都按議事規則進行。在現場衝突混亂下有誤發表決卡的情形，依據立法院職權法第四條及第六條規定，7月16日的會議只要有委員總數三分之一出席、即38席就能開會，表決時只要有出席委員過半同意就可決議。即使扣掉陳瑩那一票，還是合法，也不影響結果。游錫堃回應國民黨團質疑立院動用警察權護當時監察院長被提名人陳菊入場，所謂行使警察權，並不是在立法院區內有警察就是行使警察權，而是指「在議場內」若有立委違反議事規則或干擾議場秩序時，院長召喚警察進來議場把委員抬出去，才叫動用警察權。過去除了前院長劉闊才、梁肅戎曾動用過外，劉松藩、王金平、蘇嘉全都無動用，他目前也不考慮。 ,blue
