躋身全球前十大市值之後，台積電上攻的兩大變數？,市值一度衝上12兆元、近日帶領台股創下新高點的台積電，在三星、英特爾挑戰製程都慘敗之後，被認為在十年內技術上無對手。那麼，還有誰能影響它營收上攻？本週帶你看清楚衝擊台積電的兩大變數。已躋身全球前十大市值俱樂部的台積電，股價能否繼續飆高，首先得看第一大因素，就是智慧型手機的需求。以台積電第二季財報來看，智慧型手機的營收占比約47％、是最大來源。偏偏受疫情影響，全球手機市場走弱，也令人為台積電的營收動能捏把冷汗。IDC台灣副總監嚴蘭欣指出，今年疫情帶來了全球龐大的失業潮，消費自然緊縮。即便是對抗疫情最成功的台灣，目前手機銷售也比往年差，顯然民眾即便有了三倍券，也不會把買最新款手機當作首要花錢考量，更不要說那些還在和疫情苦苦對抗的歐美各國了。因此，目前看2020年全球智慧型手機的全年出貨，將比前一年下滑11.9%，至年底預估為12億支。工研院產科國際所分析師呂珮如的看法則更悲觀。她指出，本來之前是推估全球手機出貨量將比去年下滑一成左右，但是看到近期多國疫情二度爆發，消費有可能繼續緊縮，已下修成全年下滑15%。疫苗何時問世？將比智慧型手機功能，還要影響消費者的購買意願！有沒有辦法回溫？她認為，疫苗何時研發問世？恐怕比新手機功能多強，更能左右消費者的選擇。好在，相對其他品牌，iPhone的銷售仍是最不受疫情影響的，在中國市場表現尤其好。根據調查機構CounterPoint最新研究，今年4～6月，iPhone的銷量在中國竟不減反增，比去年同期成長了三成二！是各品牌中的成長冠軍。主要原因是前一代iPhone 11大降價引發爆買。因此即便當時中國深陷疫情，蘋果門市一度無法開張，買氣依然不減。嚴蘭欣指出，iPhone在許多消費者心中，本來就是比較保值的品牌，這從二手機行情價比他牌好就可看出。因此購買前一代iPhone的民眾不少，是讓蘋果銷售至今相對穩健的主因。台積電獲利新動能，先看iPhone 12的5奈米製程訂單至於iPhone 11主要是採用台積電7奈米製程晶片，根據台積電第二季法說財報，7奈米是目前各製程中，對營收貢獻最高的產品，因此台積電近期營收獲利皆亮眼，並非僥倖：第二季營收3107億元新台幣，較去年同期增加28.9%；單季每股盈餘則為4.66元、年增81%。但是接下來，能否在疫情仍未控制的大環境下，繼續成長，還要看台積電的獲利新動能，也就是5奈米製程的訂單而定。這其中，台積電以5奈米為蘋果打造的5G新機：iPhone 12，在下半年問世時，能否拉出新一波銷售人氣？就相當重要。嚴蘭欣指出，5G手機確實是今年全球手機唯一的成長亮點，比起去年成長高達千倍，預計到今年底將銷售2億支。但主因是基期低，去年很多地區根本還沒有5G。除此之外，以各地區銷售量來看，目前全球第一大5G手機市場是中國。蘋果要推5G新機，關鍵戰場仍是中國。也因此，下半年中國5G手機市場動態，就是關注焦點。據業內人士指出，由於今年疫情後中國內需弱，各家大陸手機品牌商，為了刺激需求，有可能祭出史上最犀利的一波手機削價戰，目前傳出甚至會有超殺的人民幣千元、約合新台幣4000元出頭的5G機種來應戰。台積電與蘋果愈綁愈緊，但你必須注意這兩大變數！不過，呂珮如並不看好過分的殺價戰，她強調，畢竟會想買5G新機的人，本來就是對品質較在意的精英族群，不會考慮用一下就壞的廉價機種。但是今年，他們確實有可能因為荷包緊縮，從以往只偏好高階品牌機種，今年退而其次買中階機。像是全球Android手機晶片陣營方面，高通、聯發科與華為海思都已注意到這趨勢，最近也往5G中階晶片在推，呂珮如預料下半年5G新機最主流的價格，會落在新台幣1萬2000元至1萬8000元左右。而在同時間，蘋果也將推iPhone 12上市，勢將遭遇到價格戰考驗。這一回，中國的果粉還會忠實挺蘋果新機嗎？iPhone 12的定價策略漂不漂亮？是屆時觀察重點。目前，台積電的蘋果訂單超過營收兩成，而華為陣營則約占14％。也就是，值得投資人觀察的兩大重點，首先是今年全球智慧型手機銷售疲弱、有可能因為疫情二度爆發更冷；第二，蘋果下半年主推的5G新機iPhone 12，將遇上陸廠史上最殺手機削價戰。這兩大因素都為台積電未來成長空間，投下變數。而被稱為台股「護國神山」的台積電能否持續衝高，也將是台股能否在突破12682的30年天花板之後，持續刷新高點紀錄的關鍵。可預見的是，因為美國祭出華為禁令，在少了華為訂單後，台積電的未來，和大客戶蘋果更牢牢綁在一起。蘋果能否持續不受疫情影響，尋出成長新方向？是關心台積電前景的台灣人，絕對不能忽視的重點。（作者／林士蕙  本文出自2020.7.29《遠見》網站，未經同意禁止轉載。） ,blue
中日空域角力多 接觸增加釀衝突,日本西南海域頻遭中國解放軍侵擾，1年近700次驅逐！日本戰鬥機飛行員代田隆道中校日前受CNN專訪時透露，日本空域面對來自中國的壓力日益增加。一份日本防衛省的報告指出，2019年日本共驅逐中國軍機675次，北大西洋公約組織27個歐洲國家的攔截總合還不及此一半。中國施壓日本根據《CNN》報導，日本戰鬥機飛行員代田隆道中校日前受CNN專訪時透露，日本空域面對來自中國的壓力日益增加。代田隆道說：「過去10年中，中國入侵我國航空領域的行為次數急速增加，特別是在西南空域。」 日本自衛隊每年大約有7成的衝突對峙都發生在此海域，因為該處有台灣、中國及日本都聲稱擁有該領土主權的「釣魚台列嶼」，這塊實質受日本統治的無人島嶼群。一份日本防衛省的報告指出，2019年日本共驅逐了675次中國軍機，北大西洋公約組織的27個歐洲國家的攔截總數還不及這個數字的一半。北美防空司令部上尉希利爾也表示，2007年開始，每年平均僅攔截來自俄羅斯的7架軍機。中稱維護主權中國外交部發言人趙立堅則表示：「釣魚島及其附屬島嶼是中國的固有領土，中國堅決維護我們的主權。」據《FR24》報導，格里菲斯亞洲研究所分析師、前澳洲皇家空軍飛行員的萊頓則認為，中國向日本的空域施壓是為了執行更大的計劃。他說：「我認為中國是在消耗日本自衛隊的能量，令人擔心的是，解放軍的戰鬥機數量是日本航空自衛隊的6倍以上，他們可能在認為適當的時候進一步加大入侵力度。」40歲的代田隆道中校則說：「我會確保日本的防空能力及全心全意保護日本人民的生命和財產安全。」防衛省報告也指出，日本計劃採用F-3隱形戰鬥機等應對中國的挑釁，也開始擬定向美國購入更多的F-35戰鬥機。此款戰鬥機被認為能與中國目前的戰鬥機一搏，甚至更強。【更多精采內容，詳見】 疫情快報 ▪【數據圖表】全球新冠肺炎確診突破1600萬大關 逾64萬人不治 ,blue
若巴西選擇華為發展5G  美國警告「後果自負」,美國駐巴西大使在今天刊出的訪談中警告，若巴西選擇中國電信設備大廠華為開發5G網路建設，將自負「後果」。法新社報導，美國駐巴西大使柴普曼（ToddChapman）告訴環球電視新聞網（Globo），若巴西不接受美國的建議，執意選擇這家中國公司，「我不會說會有報復動作，但會有後果產生」。巴西擁有2.12億人口，是拉丁美洲人口最多的國家，明年將就發展次世代電信科技計畫進行招標。美國一直以來都遊說全球各國杯葛華為，指這家公司可能允許中國政府刺探他們的數據。柴普曼表示：「中國政府隨時都可以要求華為傳送資訊。」「參與競逐的不是僅有美國企業。我說這些話並不是為了賺取數十億美元。這攸關國家安全。」其他有意競標巴西5G網路建設的公司，還包括瑞典的愛立信公司（Ericsson）和芬蘭的諾基亞公司（Nokia）。柴普曼還警告，巴西可能會因為與一家遭美國指稱違反智慧財產權、同時獲得不公平國家補助導致競爭者居於劣勢的公司簽約，而嚇走外資。他說：「美國立場是提醒盟國和友邦，像是巴西，這樣他們才知道那是什麼樣的合作對象。」柴普曼指出，美國準備透過政府所屬的「國際開發金融公司」（International Development FinanceCorporation）協助取得資金，以替「向可靠供應商進貨的買方」推展5G。美方施壓讓巴西總統波索納洛（Jair Bolsonaro）政府陷於兩難。極右派的波索納洛自去年掌權以來，一直在與他欣賞的美國總統川普建立密切關係。然而，中國是巴西最大的貿易夥伴。英國本月稍早已宣布，將從5G網路中移除華為設備，儘管北京揚言報復，仍屈服於來自華府的壓力。疫情快報 ▪【數據圖表】全球新冠肺炎確診突破1600萬大關 逾64萬人不治 ,blue
川普選情告急 美中互關領館後 關係恐續下探,特派員看世界（中央社記者徐薇婷華盛頓29日專電）7月24日，營運41年的中國駐休士頓總領事館因疑似從事諜報工作，在美國命令下人去樓空；3天後，美國駐成都總領事館也在中國報復措施下，運轉35年後降旗關閉。過去一週彷彿見證美中1979年建交以來最黑暗的一頁。不過，在美國整體重思對中政策及總統川普連任選情告急壓力下，專家普遍認為最壞時刻還沒到來，未來幾個月可能還有其他「驚喜」，美中關係恐持續下探。過去幾個月，美中雙方早因2019冠狀病毒疾病（COVID-19，武漢肺炎）疫情、港區國安法、新疆維吾爾族人權、新聞採訪自由、中國科技業巨擘華為爭議，及北京在南海作為等議題，關係急劇惡化，互關領館則一舉讓美中關係降至40年來最低點。翻開美國歷史，美方2017年曾下令俄羅斯關閉舊金山領事館以及在華府、紐約兩處附屬建築，以報復俄方涉嫌干預2016年美國總統大選並大幅刪減美國駐俄外交機構人員。要求中國關閉領館則是美中建交以來首次。曾派駐北京、有33年外交資歷的前美國在台協會（AIT）台北辦事處長楊甦棣（Stephen Young）告訴中央社記者，要求他國關閉領館是相當激烈手段，通常反映兩國關係嚴重緊張。楊甦棣指出，過去若某外國外交機構有嚴重不當事件發生，通常是會針對個人採取行動，例如將涉入人士列為不受歡迎人物或解除其外交豁免以要求離境，「因為某事件導致整個外交機構遭關閉十分罕見」。美國國務院對外解釋，要求中國關閉領館是為了保護美國智慧財產權與人民個人資訊，並指控中國長年進行間諜與影響力工作。對此，楊甦棣雖認為美方此舉大致反映美中關係更廣泛的惡化，但他分析，川普政府加大對中國強硬力度，一部分是出自選舉策略。也曾任AIT台北辦事處長的包道格（Douglas Paal）認同指出，美國要求中國關閉領館，多與美方對中國情蒐、外交上不當作為整體回應變強硬有關，但川普確實也在努力確保任內美中關係的弱化能夠持續，以作為他政治遺產。包道格表示，美國大選目前多聚焦在種族、經濟與疫情上，中國尚未成為熱門議題。他認為川普政府想要好好利用中國牌，擊敗民主黨準總統候選人拜登（JoeBiden）。他預測，川普政府從現在到11月，應會更使勁對中國強硬。包道格說：「美中關係目前處在70年代以來最低點，但我認為最壞的還沒到來。」曾任美國前總統歐巴馬政府對中與兩岸關係高級顧問、現任布魯金斯研究所（Brookings Institution）研究員的何瑞恩（Ryan Hass）表示，美中關係處於加速惡化的軌跡中，這個趨勢在11月大選前很難被打破。何瑞恩指出，雙方都認為自身作法有理，也不願因為提議降低緊張關係而被看成在積極獻殷情，他預測美中緊張情勢在未來幾個月可能再升高。華府智庫「戰略暨國際研究中心」（CSIS）中國國力專案主任葛來儀（Bonnie Glaser）則認為，川普政府官員似乎擔心川普不會成功連任，因此有種急迫性，想要把美中關係鎖在對抗中。由於過去幾個月疫情、種族示威處理不當，川普在過去2個月民調大多落後拜登，落後幅度約為8%至15%，選情堪憂。根據路透/易普索（Reuters/Ipsos poll）7月27日至7月28日調查，拜登全國支持度為47%，領先川普9%。葛來儀表示，川普政府將中國視為地緣戰略敵人，決心要與北京建立下一任美國總統無法逆轉的對抗與系統性競爭關係。她說：「離總統大選還有90幾天，我不認為美中關係已經探底，未來可能會有更多『驚喜』。」疫情快報 ▪【數據圖表】全球新冠肺炎確診突破1600萬大關 逾64萬人不治 ,blue
7月30日新冠肺炎全球最新情報 美國染疫病故人數超過15萬人,2019冠狀病毒疾病（COVID-19，武漢肺炎）延燒，疫情衝擊旅遊業，首5月營收損失逾9兆元；美國染疫病故人數超過15萬人；日本確診首度單日破千，唯一淨土岩手縣失守。根據美國約翰霍普金斯大學（Johns HopkinsUniversity）網站最新統計，截至台灣時間30日上午7時，全球至少66萬2648人死於疫情，至少1684萬9365人染疫。以下為全球各地過去24小時的疫情與相關發展：※ 亞洲● 台灣中央流行疫情指揮中心宣布，台灣29日沒有新增確診個案。目前累計維持467例，已有441人解除隔離。泰籍移工返泰後確診，疫情指揮中心29日宣布，移工在台灣的189名同公司接觸者，檢驗結果皆為陰性。據了解，確診移工採檢呈弱陽性，盼泰方做第2次採檢。● 中國中國28日新增確診病例多達101例，本土病例就占了98例，其中以新疆89例最為嚴重，北京也連續第2天出現確診者。● 香港武漢肺炎持續在香港社區擴散，29日新增118例，113例為本土感染病例，累計確診個案達3002例，至今有24人病逝，死亡率0.8%。● 日本日本確診病例29日新增1229例，首度單日突破千例，其中東京250例、大阪府新增221例。原本被喻為唯一「淨土」的岩手縣29日有人確診，日本47都道府縣全面都有疫情。● 北韓俄羅斯駐北韓大使館29日表示，北韓宣布正在調查首起可能的確診病例後，北韓當局提醒旅居平壤的外國人士遵守防疫措施。● 菲律賓菲律賓衛生部29日通報，新增1874人確診，累計確診數達8萬5486人。境內又有16人染疫死亡，死亡總數來到1962人。● 印尼根據印尼衛生部資料顯示，29日新增2381人確診，染疫人數10萬4432人。另外，又有74人染疫死亡，不治人數達4975人。● 新加坡新加坡衛生部29日通報，境內新增334人確診感染武漢肺炎，其中絕大多數仍是住在外勞宿舍的移工，另有3起社區病例及4起境外移入案例；全國累計確診總數達5萬1531例。● 澳洲澳洲人口第2大州維多利亞州29日通報，州內新增295起確診病例，這是逾一個星期來首度單日通報低於300例。● 越南越南29日新增12起確診病例，除觀光聖地峴港再添8人確診，還有首都河內一例、中部高原一例和胡志明市兩例，使染疫總數達到450例，沒有死亡病例。● 泰國泰國內閣會議29日通過緊急狀態再度延長到8月底，以便有效控制疫情。而泰國政府將再放寬外國人入境泰國，以促進經濟發展，但何時上路仍待討論決定。● 印度印度全國已有逾150萬人確診，其中近3萬5000人病歿。印度衛生部網站29日通報新增近5萬人確診、768人不治。※ 歐洲● 英國英國29日表示，已和法國賽諾菲（Sanofi）以及英國葛蘭素史克藥廠（GlaxoSmithKline, GSK）簽訂合約，採購多達6000萬劑的武漢肺炎疫苗。這是英國第4次出手預購疫苗。● 西班牙總部設於西班牙馬德里的聯合國世界觀光組織（World Tourism Organization）28日表示，全球旅遊業受疫情重創，今年頭5個月損失高達3200億美元（台幣約9兆3700億元）營收，威脅數百萬人生計。● 俄羅斯俄羅斯29日通報新增5475人確診，染疫總數達到82萬8990例，同時，俄國在過去24小時又有169名患者不治，染疫病歿總數達1萬3673人。● 法國法國衛生當局29日通報新增1392人確診2019冠狀病毒疾病，創下逾1個月來單日新增最多病例的紀錄。目前法國累計已18萬5196人確診，死亡人數累計增至3萬238人。※ 美洲● 美國根據美國約翰霍普金斯大學統計，美國因感染2019冠狀病毒疾病病故的人數已超過15萬人，來到15萬34人，境內確診總人數超過439萬人，來到439萬6030人。美國連鎖咖啡品牌星巴克（Starbucks）上季營收下滑38%，但表示旗下商店自疫情解封後重啟營業，公司業績恢復速度比預期還快。美國新聞網站Politico報導，共和黨籍聯邦眾議員戈默特（Louie Gohmert）在疫情期間堅持不戴口罩，29日確診2019冠狀病毒疾病，令人憂心其他國會議員的健康。● 加拿大加拿大政府28日批准使用抗病毒藥物瑞德西韋（remdesivir），來治療武漢肺炎重症患者。● 巴西巴西29日通報新增6萬9074例感染、1595例死亡，確診病例累計破250萬例，不治病例累計9萬134例。疫情在巴西爆發以來，有關高峰期的預測隨著疫情發展一再延後。專家表示，人民生活困頓無法長期在家隔離和各級政府行動不一致，導致疫情結束遙遙無期。● 哥倫比亞哥倫比亞29日通報，累計確診數超過26萬7300起，9074人染疫死亡。哥倫比亞政府宣布，因疫情而採取的封鎖措施將延長一個月到8月底。疫情快報 ▪【數據圖表】全球新冠肺炎確診突破1600萬大關 逾64萬人不治 ,blue
高通財測俏、與華為解決授權糾紛　盤後飆漲12%,高通公布的本季財測樂觀且大幅優於市場預期，顯示5G手機服務正在起飛。高通還宣布與中國大陸華為公司解決了授權糾紛、達成新授權協議，消息激勵高通盤後股價上漲近12%，一度大漲13%。●與華為達成新授權協議　將追回欠款高通29日表示，已經與華為解決一項授權糾紛，華為將在本季度補交高通18億美元的欠款。高通說，儘管受限於美國監管當局的規定，華為現在仍不得購買高通的晶片，但華為現在已恢復向高通支付無線技術的授權費。●本季營收高於市場預期　高通公布，在截至9月底的本季度，剔除特定項目的營收將達55億至63億美元，高於分析師預估的57.7億美元。若計入來自華為的欠款，營收將達73億至81億美元。本季不計特定項目的每股盈餘將為1.05美元至1.25美元，符合市場預期。不過，高通對晶片的本季營收預估略低於分析師預期，分析師認為，這是因為蘋果今年新旗艦機款可能延後推出所致。高通去年與蘋果公司解決法律糾紛後，今年初宣布敲定協議、恢復向蘋果銷售，並且預測5G服務會帶來營收成長。高通預估本季晶片出貨量中位數為1.55億支，略低於市場預期的1.59億支。●本季營收稍微受「某旗艦機款延後推出」影響　暗指蘋果iPhone？高通財務長帕爾基瓦拉（Akash Palkhiwala）表示，高通預期會在下一季彌補部分銷售，「我們見到，有部分影響是來自一款旗艦手機延後推出。因此，這稍微延後把（7月至）9月這一季的一些手機出貨移到（10月至）12月的一季。」儘管高通財務長並未點名是哪家品牌的旗艦機款，但分析師普遍認為是蘋果的新旗艦機。●上季營收持平　看好5G服務起飛雖然高通長期來供應處理器與數據機，協助手機連線至無線資料網路，但高通也銷售無線射頻晶片，協助手機製造商處理包括5G網路在內的更複雜訊號。帕爾基瓦拉說，高通預期贏得所有主要智慧手機製造商的銷售，包括在本季面臨旗艦機款延後推出的客戶，「 可以這麼說，我認為我們預期會賣給他們所有廠商」。高通表示，上季經調整後的營收為48.9億美元，與去年同期差不多持平，而市場平均預估為48億美元。上季淨利為8.45億美元，每股盈餘74美分。不計特定項目的每股盈餘為86美分，而華爾街的平均預期為70美分。高通執行長莫蘭科夫（Steve Mollenkopf）表示：「從（4月至）6月一季疫情中回升的情況比我們預期得更強勁，主要是在已開發市場與中國。現在我們要邁入第二個轉折店，也就是全球的5G的推出。」疫情快報 ▪【數據圖表】全球新冠肺炎確診突破1600萬大關 逾64萬人不治 ,blue
中國不讓步 歐盟對投資協定談判進展失望,歐盟與中國官員近日進行經貿高層對話，討論投資協定，不過在開放市場等關鍵問題上中方仍不讓步，讓歐盟感到失望，香港人權問題也是雙方談判的障礙。歐盟執行委員會副主席杜姆布羅夫斯基斯（ValdisDombrovskis）28日與中國國務院副總理劉鶴進行第8次中歐經貿高層對話，討論投資協定，目標在今年內完成談判。歐中投資協定的談判進行6年多，如果簽署將是雙邊關係的里程碑。德國「商務日報」（Handelsblatt）引述歐洲聯盟（EU）知情官員報導，儘管雙方對公平競爭條件有共識，不過關鍵的市場開放問題仍沒有進展，在通信、資訊、健康、生物科技和電動車領域，歐洲企業仍無法與中國國有企業享受相同待遇。此外，歐盟也對中國限制歐洲肉品進口不滿，歐洲企業則抱怨中國對外資的限制。中國在談判時不讓步，讓歐盟官員驚訝，畢竟在中美關係緊繃的情況下，中國應改善對歐關係。中國在香港特區實施國家安全法，對雙邊關係顯然也造成衝擊。歐洲議會國際貿易委員會主席朗吉（Bernd Lange）說，投資協定談判最主要的障礙是中國的不公平貿易行為和香港的人權問題。儘管歐盟對外宣稱希望在年底前完成談判，歐盟和歐洲企業對近期完成談判已不抱太大希望。歐洲議會對中關係代表團團長包瑞翰（ReinhardBütikofer）研判，中國有意等到美國總統大選結果揭曉後再做下一步動作。不過，屆時歐盟也可能與新的美國政府合作施壓中國改變。疫情快報 ▪【數據圖表】全球新冠肺炎確診突破1600萬大關 逾64萬人不治 ,blue
