影／探視李登輝 賴清德「我們繼續祝福李前總統」,總統蔡英文、副總統賴清德與行政院長蘇貞昌今上午到榮總探視前總統李登輝。賴清德今下午在屏東縣出席，台南市長黃偉哲與台南市修繕志工團，與屏東縣府「百工師傅志工團」經驗交流座談會，會前賴清德被媒體問到探視李前總統情況，賴清德說，「感謝榮總醫療團隊全心全力給予李前總統最好的醫療，我們也繼續祝福李前總統」。賴清德說，今天蔡總統，他本人跟蘇貞昌院長，前往台北榮總探視李前總統並且慰問家屬，「感謝榮總醫療團隊全心全力給予李前總統最好的醫療，我們也繼續祝福李前總統，他的情況就是這樣」。 ,blue
江啟臣：美陸變局 中華民國應避免淪為棄子,國民黨主席江啟臣今天表示，面對美陸變局以及複雜的國際局勢，提醒蔡總統謹慎面對，應該回到中華民國以及2300萬人的利益為優先，保持自主性，避免淪為單一方的籌碼甚至棄子。國民黨下午召開中常會，江啟臣表示，7月21日美方要求中共當局關閉駐休士頓總領事館，7月23日，美國國務卿蓬佩奧（Mike Pompeo）說：「如果不改變中共，中共將改變我們」，直接宣示美陸關係轉向。7月27日，美國駐成都領事館在中共當局的要求下也正式降下星條旗，結束35年的服務。江啟臣說，站在歷史轉折點上，更應該思考中華民國如何在美陸對峙下尋求有利的支點，用彈性的對外政策，開拓發展道路。總統蔡英文曾說，「不要忘了我們自己也是棋手」。江啟臣表示，面對美陸變局以及複雜的國際局勢，國民黨要提醒蔡總統應該謹慎面對，更應該回到中華民國，以及2300萬人的利益為優先，保持自主性，避免淪為單一方的籌碼甚至棄子。他說，國民黨身為最大的在野黨，絕對願意站在維護國家利益的立場上，共同對外；但是在內政上，指出執政黨錯誤的作為，是在野黨天職。他表示，目前憲政制度對於總統的尊崇是建立在總統的自我約制，而不是權力制衡，造成總統有權無責、一人獨大的憲政危機。監察院的人事權，已經再次凸顯缺乏自制的總統，破壞了權力平衡。除了立法院黨團已經加速研議提出釋憲訴求審查無效之外，仍必須回到制度設計上，進行修憲總體檢，設計一部「權責相符」、「監督制衡」、「防止濫權」的「中華民國憲法」。他說，國民黨團不但要儘速提出「總統國情咨文常態化」、「閣揆同意權」兩項有高度民意共識的修憲案，「護民主、打濫權」更是國民黨討論修憲案的基礎與共識。除了思考廢除沒有制衡能力的組織與人事，也要研擬廢除後重建的配套制度。江啟臣強調，國民黨會加速對內對外的溝通對話，並且確保考試權、監察權回歸獨立運作，而不是成為總統權力延伸、完全綠化的東廠。他認為，國際疫情仍在高峰，長江的洪災，以及德州颶風災情也尚未緩解。對內，國民黨要提醒防疫相關單位，零星個案已經凸顯第二波疫情的潛在威脅，疫苗研發速度更可能決定秋冬防疫的成效，防疫單位應該調整政策，加速研發步伐。對外，呼籲美陸雙方謹慎節制，以民生為優先，以救災為優先，以防疫為優先，一起關懷在氣候以及疫病中遭受苦難的人民。 ,blue
探視李登輝 蘇貞昌：表達關心與祝福,行政院長蘇貞昌今天上午與總統蔡英文、副總統賴清德前往榮總探視前總統李登輝。蘇貞昌說，他對李登輝表示祝福，也向家屬表達關心；至於李登輝的狀況，由醫療團隊說明。李登輝今年2月間因喝牛奶嗆到住進北榮治療，一住就是半年，昨天網路傳出他病逝消息。北榮院方今天澄清，李登輝身體狀況雖不理想，卻不到外界傳聞程度，仍在醫院治療中。蔡總統、賴副總統、蘇貞昌上午到台北榮總探視李登輝，對家屬表達關懷，並聽取李登輝醫療團隊簡報後離開。蘇貞昌下午出席「金管會獎勵本國銀行加速辦理紓困振興貸款方案評比優等銀行表揚典禮」前受訪表示，李登輝對台灣民主的貢獻，為國家做事，大家非常敬佩，上午他跟蔡總統、賴副總統一起到醫院探望李登輝，表示敬意跟關心，至於李登輝的狀況應由醫療團隊說明比較清楚。蘇貞昌指出，上午前往醫院時也有向家屬表達關心，並對李登輝表示祝福。針對國中小學全面裝冷氣，有民進黨立委擔憂可能裝得起但吹不起。蘇貞昌表示，為孩子在學校教室裝冷氣是蔡總統指示，也是教育、家長及老師團體的一再呼籲，政府看到孩子的辛苦跟家長的心急。政府籌措經費，整個團隊動起來，承諾要在2022年2月底前，讓中小學班班有冷氣。蘇貞昌指出，教育部已跟各地方政府講好，分級進行部分負擔，有的地方只需負擔10%，絕大部分由中央負擔，中央負擔整個電力配置費用、冷氣裝設費用，將來電費也都有補助。給孩子安全舒適的校園，政府會努力來做。他呼籲，除節約能源外，也要開闢能源，推動太陽光電。已讓經濟部、台電及教育部跟地方政府一起，讓有意願的學校裝設太陽光電板。進一步會給學校節能減熱設施，往後也要多種樹，政府會從各方面來，最重要是讓孩子有舒適學習環境，減輕家長憂慮。對於文化部終止公視「國際影音平台」委託案，蘇貞昌表示，大家都看到，很多國家有國家發聲的頻道，像是英國的BBC及日本的NHK，台灣的好要讓世界看見。這次台灣防疫成功，各國肯定、羨慕台灣，若有頻道讓世界看到台灣，相信也是國人所樂見，至於公視節目怎麼製作、頻道如何應用，政院都尊重。媒體詢問，在野黨質疑三倍券的成本暴增。蘇貞昌指出，各界對三倍券有很多關心跟指教，也看到國人都在領三倍券，業界、地方政府都紛紛加碼，大受歡迎，證明三倍券好領、好用、好刺激，希望不斷循環刺激，讓經濟更好。 ,blue
影／江啟臣籲蔡英文 勿成美中角力中的籌碼或棄子,國民黨主席江啟臣今天主持中常會，談話時針對美中關係角力越演越烈表達關注，但也呼籲蔡英文總統在此國際關係轉折點，當以中華民國與全體國民利益為優先考量，用更務實與彈性的政策為考量，切勿成為某一方的籌碼或棄子。美中兩國相互關閉對方的領事館，導致對立氣氛越演越烈，在這樣歷史轉折點上，江啟臣提醒蔡英文自己也是棋手，不要讓自己成為某一方的籌碼或是棄子，國民黨身為最大在野黨，會與政府一致對外，但在國家內政上會持續監督政府施政，維護全民利益。國民黨主席江啟臣今天主持中常會，呼籲蔡英文總統勿成為美中對峙角力中的籌碼或是棄子。記者潘俊宏／攝影國民黨主席江啟（後排右）臣今天主持中常會，呼籲蔡英文總統勿成為美中對峙角力中的籌碼或是棄子。記者潘俊宏／攝影 ,blue
蔡英文主持中常會 為李登輝健康祈福,前總統李登輝今年2月因喝牛奶嗆傷住院至今將近半年，昨天傳出病情惡化，今天早上蔡英文總統、副總統賴清德及行政院長蘇貞昌都前往北榮探視。蔡總統稍早在民進黨中央主持中常會時，向中常委說明早上前往北榮探視李前總統，她也表示，「為李前總統的健康祈福，並持續關心李前總統健康。」李登輝今年2月8日晚間在家中由護理師量測血壓、血糖後，喝牛奶補充營養，卻因喝太快嗆到、咳不停，緊急送往北榮發現肺部浸潤，住院至今將近半年，昨天突然傳出李登輝病情惡化、拔管病逝消息。北榮院方今天上午澄清，李登輝身體狀況確實不理想，但人仍在醫院接受治療，還不到外界傳聞的程度，但家屬並未授權，無法針對病情做進一步說明。總統府也表示，蔡總統、賴清德及蘇貞昌今天上午9時30分前往北榮探視李登輝，並向李登輝家屬表達關懷，同時聽取醫療團隊簡報，探視於10時10分結束。北榮院方表示，前總統李登輝身體狀況確實不理想，但人仍在醫院接受治療。聯合報資料照前總統李登輝的夫人曾文惠上午離開翠山莊前往台北榮總。記者黃義書/攝影李登輝前總統驚傳病情惡化，李家轎車今天載著親友進出台北榮總。記者邱德祥／攝影 ,blue
探望李登輝 蘇貞昌：敬佩李對民主貢獻、為國家做事,前總統李登輝傳出病況不佳，蔡英文總統、副總統賴清德、行政院長蘇貞昌今早都前往探視。蘇貞昌下午出席「金管會獎勵本國銀行加速辦理紓困振興貸款方案評比優等銀行表揚典禮」 時受訪表示，李前總統對台灣民主貢獻、為國家做事，大家都非常敬佩，自己一早和總統、副總統一起到醫院探望李，也表示敬意和關心。蘇貞昌說，李前總統的狀況應該由醫療團隊來說明比較清楚，上午也有向家屬表示關心，並對李前總統表示祝福。李登輝辦公室主任王燕軍稍早也發表聲明指出，蔡總統、賴副總統及蘇院長在今日上午前往探視李前總統，相關訊息均由總統府發言人統一對外說明；有關李前總統病情則由榮總以新聞稿對外公開。 ,blue
影／王浩宇考問高雄地理 李眉蓁反問：桃園有幾間廟？,國民黨高雄市長補選候選人李眉蓁今上YAHOO「鄉民大會」直播節目，被桃園市議員王浩宇考問高雄地理環境及青年失業率數據，沒答對後，被王酸不解國民黨為何提名她。李眉蓁反擊問他桃園有多少廟宇，王則說不能問太複雜問題，引發網友議論。今中午YAHOO「鄉民大會」由郭子乾扮演的韓國瑜當主持人，邀李眉蓁、王浩宇及國民黨副秘書長、台南市議員謝龍介和媒體人黃暐瀚、民眾黨公關事務長吳怡萱等人上節目，談高雄市長補選等議題。李眉蓁說，沒想到最近受到這麼多關注，但這兩天出去跑，給她鼓勵、加油的聲音變多了，讓她有鬥志繼續往前衝，選情也倒吃甘蔗。謝龍介批評行政院長開選舉支票要給陳其邁4千億高雄建設經費，「吹牛不用繳稅金，也不用負責、下台」。王浩宇則在節目中考問李眉蓁高雄最北、最南、人口最多的行政區及青年失業率數據等，李眉蓁沒答對後，王酸她對地理環境不了解，如何當市長，不解國民黨為何選她參選。李眉蓁反擊說，問題太細，她可能沒答對，但她從小高雄長大，知道高雄要的是什麼，而不是哪裡最北、最南，她知道在民進黨執政2、30年後，高雄人還再買水，空汙也沒改善。郭子乾也緩頰說，這樣問答，「維基百科就可以當市長了」。李眉蓁並反問王浩宇，「你是桃園議員，那我請問桃園有幾間廟？」沒料到被這樣問的王浩宇說，「這問題太複雜，你不能問這個問題，太複雜，問幾區我知道」。王並指是國民黨把石化業放在高雄。謝龍介反批是民進黨錯誤的林園政策，且高雄已民進黨執政多年，不要再叫國民黨負責。李眉蓁也問，為何民進黨執政20年不改變？王則答說，20年民進黨長期有在關心空氣、水的問題。黃暐瀚說，王浩宇有激怒人的本事，但替李眉蓁拉了不少票。這段問答也引起直播線上網友熱議，網友說，「桃園有登革熱、新冠肺炎可疑傳染，你是桃園議員，做了什麼？」、「請記得王浩宇如何問問題，以後他選市長，記得問他垃圾問題」、「罷免票又拉了不少」、「中壢人罷起來」，但也有人批國民黨選不贏市長，也要賺選舉補助款。談到選情，黃暐瀚說，李眉蓁要贏陳其邁很困難，要先想怎麼守住30%基本盤，再努力往上追。吳怡萱說，選前大利多，只有執政黨才拋得出來。吳怡萱還說，民進黨塑造形象的本事一等一，總統蔡英文說陳其邁不一樣了，她贊同，因為陳其邁從過去立委剽悍罵「我是你爸爸」風格已看不到，變成愛貓大暖男，這是選舉操作，塑造形象這點要跟民進黨多學習。李眉蓁說，她比陳其邁優秀，選陳其邁就是選民進黨，連基本的陽光、空氣、水都做不到，給民進黨執政這麼久，高雄水仍不好、還要買水，負債3千億，接連選舉3次，寧願花錢在選舉上，不把錢拿來用於惠民政策；她是高雄人，最清楚高雄人要的是什麼。 高雄市長補選   ▪參選人資料／藍綠政二代對決白橘混血議員 高雄市長補選3將比一比 ,blue
蔡英文出席中常會 未回應李登輝狀況,蔡英文總統上午與副總統賴清德、行政院長蘇貞昌，前往台北榮民總醫院探視前總統李登輝。蔡英文下午出席中常會時，面對提問僅揮手致意，並沒有針對李前總統病情做出回應。蔡英文（右）下午出席民進黨中常會。記者林澔一／攝影 ,blue
「公視非中國央視」 時力籲檢討公視法,針對文化部緊急叫停要給公視58億設立國際平台1案時力黨主席徐永明不滿表示，雖然文化部在時力記者會召開前緊急發新聞稿，宣布取消設立平台的方案，但這其實顯示出公視長期預算缺少、缺乏獨立性的問題，要趁現在好好檢討《公共電視法》。「公視不是中國央視，政府不能用公視進行大外宣！」文化部原本將撥58億預算給公視建立國際宣傳平台，但董事對於程序問題激辯，最後以11比4的結果，通過追認國際影音平台前導計劃案，但公視總經理曹文傑等3位高層宣布請辭，引發外界強烈議論，也讓文化部29日一早緊急發新聞稿，宣布取消設立平台的方案。檢討公視法提升獨立性徐永明呼籲，立法院要請文化部專案報告整件事情的來龍去脈。他批評，民進黨政府不能以「只要我喜歡，有什麼不可以」的心態做事，公視並不是央視，國外BBC也不是幫住英國政府宣傳的機構，是靠長期的內容品質保證，獲得國際閱聽人的信賴。他也希望立法院開始著手檢討《公共電視法》的修定。「公廣集團要做商業媒體不能做的事，其中也包含超脫政府的監督。」媒體改造學社律師周宇修也說，雖然這次文化部給公視錢看起來是發展公廣集團，可是公視本身的預算只有9億，接了文化部的案子，本業無法維持，還會受制於文化部，變成政府的大外宣工具，這卻不是公廣電視的目的。他以王建民舉例，當初王建民2005年剛上大聯盟時，沒有商業媒體願意負擔大聯盟的高額轉播金，但是公視挺身而出，吸收高額轉播金，讓國人可以即時看到王建民，也因此台灣的棒球文化遍地開花，而且公視在人文、環保等內容都具有高品質的產出，這些都是一般商業媒體避之唯恐不及的內容。國際服務非大外宣「沒有公視，就沒有『我們與惡的距離』。」曾短暫任職過BBC的時代力量立法院黨團副主任白卿芬說，這麼冷門卻值得關心的議題只有公視做得出來，因此需要檢討的是《公共電視法》，讓公視有更多合理、不受外力干擾的財源，製播優質、引領傳媒文化的節目、推廣價值。她並指出，英國BBC是國際服務頻道，不是國際宣傳頻道。瑞士、德國、韓國與日本的NHK都可以保有很高的獨立性，公視設立國際平台不是說宣傳蔡英文政府做得多好，而是用台灣文化吸引、獲得世界公民認同。時代力量智庫執行長李兆立直言，大外宣是中央社、央廣該做的，不是公視。【更多精采內容，詳見】  ,blue
公視董事批國際平台急卡 再度證明文化部隻手瓦解董事會,文化部委託公視規畫的國際影音平台前導案，因爭議不斷，今發新聞稿宣布終止，但爭議未平息，不少董事譴責文化部。贊成此案的董事徐瑞希在董事群組宣布即刻辭職，抗議文化部「說一套做一套」；反對此案的董事馮小非雖認為該案早該終止，但也質疑文化部此舉再度證實「不論有沒有董事會，決定權都在我。」公視高層5月底告知內部同仁將執行文化部4500萬元影音平台前導案以來，期間雖經歷6月董事會，但一直到7月16日董事會上，馮小非發現現場書面報告有國際影音平台相關文字，公視總經理曹文傑卻未口頭報告，此事才掀鍋，要求公視7月27日另開臨時董事會。會員專屬內容立即登入！全年暢讀專屬報導加入會員登入閱讀快體驗，無廣告干擾的暢讀空間 ,blue
多益9月首辦普及口說測驗 釋免費名額給中小學師體驗,在台代理多益測驗的忠欣公司今天表示，今年9月將於台灣首度舉辦多益普及口說測驗，考試時間約15分鐘，首場開放100個免費測驗名額，讓中小學非英語科學科老師搶先體驗，為雙語教學準備。報名從即日起到9月2日止。忠欣公司表示，多益是針對初、中階學習者掌握生活基礎英語設計，能評量「聽讀說寫」四項基礎英語技能，完整檢視英語學習成效。測驗以日常生活實用情境為主，符合108課綱核心素養導向的學習精神。而多益普及口說測驗是其中單獨評量英語口說基本能力的測驗。多益普及口說測驗測驗時間約為15分鐘，題型包括朗讀、照片描述、故事描述、主旨重述、提議、簡短互動等，測驗主題多元且生活化，有旅遊、安排餐會、購物等情境，容易上手，切合目前台灣英語學習者的需求。蔡英文總統打出2020雙語國家政策，日前調查指出，全台僅10.5％非英語科教師能用英語教學，忠欣公司說，盼此測驗能增加老師信心。忠欣公司說，多益普及口說測驗今年9月27日將在台灣舉辦第一場考試，分別在台北、桃園、台中、台南、高雄設考區，報名即日起到9月2日止。測驗共有八題，分為六種題型，測驗時間約15分鐘。應試者作答的內容會以數位方式錄音，再傳送到ETS線上評分系統，由評分人員評分。 ,blue
李登輝住院傳病情惡化 妻曾文惠赴北榮探視,今年2月因喝牛奶嗆到的前總統李登輝住院至今將近半年，昨天傳出病情惡化。李登輝夫人曾文惠中午11時許抵達北榮，李辦主任王燕軍表示，家屬有空都將全天候陪同。前總統李登輝今年2月8日晚間在家中由護理師量測血壓、血糖後，喝牛奶補充營養，卻因喝太快嗆到咳不停，緊急送往北榮發現肺部浸潤，住院至今將近半年，昨天突然傳出李登輝病情惡化、拔管病逝消息。北榮院方今天上午澄清，李登輝身體狀況確實不理想，但人仍在醫院接受治療，還不到外界傳聞的程度，但家屬並未授權，無法針對病情做進一步說明。總統蔡英文、副總統賴清德、行政院長蘇貞昌今天上午9時30分前往北榮探視李登輝，並向李登輝家屬表達關懷，同時聽取李前總統醫療團隊簡報，探視於10時10分結束。隨後又傳出李登輝的妻子曾文惠上午11時在看護與隨扈陪同下，從翠山莊外出，約在11時30分抵達北榮探視。李登輝辦公室主任王燕軍受訪時證實此事，他表示，家屬只要有空，全天都會陪同。 ,blue
電子連署成空談？羅智強：明年8月公投門檻恐難過關,公投法中明定「主管機關應建置電子系統，提供提案人之領銜人徵求提案及連署」，台北市議員羅智強上午舉行記者會，指中選會一直未將公投電子系統上線，若仍用紙本連署，將增加繁瑣和困難度，變相降低明年8月公投通提案過的門檻。他希望公投電子連署，台北市能先行。對此，民政局指出，台北市版的公投電子連署及查對作業辦法目前已經公告。台北市議會國民黨團去年提出台北市公民投票自治條例修正草案，包括建置電子連署機制，議會三讀通過；民政局自治行政科長莫祥雲指出，北市已訂定台北市公民投票電子連署及查對作業辦法，今年7月24日已經公告，至9月21日止，最快這個會期送議會備查。羅智強指出，民進黨執政後將公投法與大選脫勾，企圖降低投票率使公投通過難度提高，中選會也遲未將電子系統上線，難道是刻意刁難人民？且下次公投日訂為明年的8月底，根據公民團體提出的時程表，提案後尚需60日審核，審核結束後還需拿到30萬人的連署書，經中選會核實後再公告90天，若公民團體想提案，最晚8月初就得起步，否則根本來不及。社團法人負數票協會理事長張天鷞指出，實施口罩實名制，從構想到執行只要2個月時間，為何公投電子連署系統從2017年11月到現在已經2020年7月都沒有做好，安檢需要這麼久？還是故意不為？尤其利用電子連署，防疫又環保，為何不做？核四公投領銜人黃士修說，中選會說電子連署不能用健保卡，因健保卡屬特種個資，依法不能蒐集，但實名制口罩和領三倍券，都是使用健保卡，為何人民不能用自己的健保卡進行公投連署。他批評中選會和行政院官員，包括政委唐鳳、行政院前資安長陳其邁尸位素餐，打壓公投。黃士修說，中央打算使用已經是落日措施的自然人憑證，但全國只有三分之一的人有，其實最便民的方式就是健保卡，甚至手機金融數位認證也可以。羅智強也說，民進黨一朝執政作廢公投，蔡英文總統對得起蔡同榮嗎？且唐鳳為什麼不做，非不能而是不為。他說，他詢問中選會，安檢要到何時？得到的答案是109年今年8月取得iso資安驗證才會盡速上線，他批評唐鳳，只要和資訊科技有關，就被封為神，但碰上民進黨公投神主牌，鳳神就消失不見了。 ,blue
李登輝辦公室主任王燕軍發表三項說明,李登輝辦公室主任王燕軍稍早發表三項說明：一、蔡英文總統、副總統賴清德及行政院長蘇貞昌在今日上午前往探視李前總統；二、相關訊息均由總統府發言人統一對外說明；三、有關病情則由榮總以新聞稿對外公開。王燕軍還表示，感謝大家的關心與辛勞，他從沒有說過要當面對外說明或受訪，拜託大家不要亂傳以免徒增困擾。 ,blue
北榮證實李登輝狀況不佳 蔡英文賴清德蘇貞昌急赴探視,（12:23更新）李登輝辦公室主任王燕軍發出3點聲明：1.蔡總統、賴副總統及蘇院長在今天上午前往探視李前總統。2.相關訊息均由總統府發言人統一對外說明。3.有關病情則由榮總以新聞稿對外公開。（11:00更新）總統府表示，蔡總統今天上午9時30分，偕同副總統賴清德、行政院長蘇貞昌，前往台北榮民總醫院探視前總統李登輝，同時也向李前總統家屬表達關懷。總統等三人也聽取李前總統醫療團隊簡報，並感謝醫療團隊妥善照顧的辛勞。探視於上午10時10分結束。（10:18更新）蔡英文總統、副總統賴清德、行政院長蘇貞昌等人，今天上午抵達北榮，探視前總統李登輝。（09:50更新）前總統李登輝今年2月因喝牛奶嗆到住進台北榮總治療，已173天仍未出院，昨天網路傳出他病逝消息，雖凌晨台聯黨（台灣團結聯盟）於臉書發文澄清，但今天北榮仍聚集大批媒體守候，副總統賴清德也取消上午行程，將於10時改赴榮總探視前總統李登輝。李登輝2月8日因喝牛奶嗆到送往台北榮總，當時因肺部有些微的感染而留院觀察，住院至今不時傳出病情惡化及逝世等消息，但均被李辦否認。昨天晚間又再次傳出李登輝病情惡化、已於晚間9時拔管病逝消息，甚至連作家漁夫也於臉書專貼相關消息。但北榮院方皆封口不願證實已拔管，只表明狀況確實不佳，一切由李辦說明。台聯黨則於今天凌晨以臉書發文澄清，強調李登輝逝世是假消息，目前還在醫院治療。今天北榮大廳仍聚集大批媒體，等待李辦與院方說明。副總統賴清德也取消上午行程，將於10時改赴榮總探視李登輝。大批媒體於北榮守候。記者楊雅棠／攝影2012總統大選決戰之夜，前總統李登輝（右）到新北市板橋第一體育場舉行的「愛出來．拚未來」選前之夜，擁抱力挺民進黨總統候選人蔡英文（左）。圖／聯合報系資料照片 ,blue
