title,content,answer
匯率、運輸 第三季變數大增,美國聯準會(Fed)最新的褐皮書揭露，美國經濟在七月初出現了復甦萌芽，但仍遠低於疫情發生之前的水準，且經濟前景依然維持高度不確定性。而這個不確定性不單單來自於COVID-19確診人數單日7.7萬人的新高(截至7月17日)，更急迫的危機是7月25日的失業救濟金政策不能延長的話，前聯準會主席柏南克與葉倫都認為美國經濟將遭遇重大打擊，德意志銀行認為，如果失業救濟金政策不能延長，對第三季GDP增長的拖累將達到3~5%。中國水患 災後重建推升原物料上漲如果真的出現民主黨與共和黨的意見紛歧，失業救濟金政策不能延續，美股大跌，那麼7月28日至29日的FOMC會議說不定會跌破市場眼鏡的再加碼寬鬆貨幣政策，這就能解釋為什麼近期美元指數朝95.71前低點下探，如果美元指數繼續弱勢，則原物料市場可能成為第三季的投資方向。美原油自從四月下旬出現負油價結算後，目前站穩每桶40美元。COMEX黃金就更不用說了，多頭排列站上1800美元，華爾街投行大多認同年底或明年挑戰每盎司二千美元，特別的是，COMEX銅第二季上漲22.51%，Ｋ線圖竟然出現類似COMEX黃金大漲之前的Ｗ底型態，基本金屬的好日子要來了嗎？至少巴西的疫情也是居高不下，終究影響了鐵礦石主力的供需，相信不久的將來有機會突破前高2019九年7月的924.5元人民幣。驅動這波原物料上漲的理由是什麼呢？或許就是半個中國泡在水裡的災後重建。糧食泡水的供給短缺，應該是促使這次即使美中關係惡化，但中國依舊履行美中貿易第一階段協議的農產品採購承諾，從大商所的玉米、豆一主力期貨的走勢明顯強於CBOT玉米、大豆期貨，可見得這次原物料的上漲，不單單只是美元貶值的影響，基本面供需出現變化，也是背後推升的動力。人民幣收盤跌破七元兌一美元，從技術線型呈現相對強勢，這是自2018年起的美中貿易戰過程中，罕見的訊號，為什麼呢？過去每當美中關係惡化時，雙方都提高分貝互相嗆聲，此時的人民幣就會走貶，意思是談不攏，你加我多少關稅，我就貶值多少彌補回來。人民幣不貶反升 推動中國內需消費但自從港版的國安法實施後，美國開始施壓中國開放所有選項，包括美國取消香港特殊待遇、考慮全面停止發放簽證給中國共產黨黨員及家眷、雙航母進入南海等制裁手段，可以說美中關係處在建交四十年來的最低潮，但是人民幣不貶反升，從中國外交部各層級的正式談話中，明顯可以發現中國在緩頰，似乎打算在美國總統大選前最後百日期間，採取低調的哀兵政策，目的可能是想趁著川普的選情不妙之際，利誘川普。配合中國啟動內循環經濟，升值的人民幣有利消費力，也有利於滬深股市的資金行情，可追蹤大消費性的家電、汽車產業，在長江流域水災過後的重新添購的投資機會。不過值得一提的是，自去年首批科創板股票上市以來，今年7月22日一批科創板個股將迎來解禁時間。本周共有29支科創板個股解禁，其中解禁總市值為1798億元人民幣，占本周滬深股市解禁總市值近80%。其中解禁個股不乏中微公司、安集科技及瀾起科技等一眾科創板明星股，估計因中芯國際掛牌漲三倍的利多出盡後，接下來的寒武紀掛牌可能也無力挽救拉回整理的局面。新台幣持續升勢 疫情延燒 拖累出口貿易人民幣若真持續走升，影響所及便是新台幣也隨之升值，升破29.5美元關卡的新台幣，似乎仍有持續朝28.5元兌一美元靠攏的跡象。這點挺讓人憂心的，因為接下來進入到返校潮的鋪貨期，如果新台幣升破29元的話，那麼就連台積電也會出現匯損，在7月17日的法說會上，台積電以新台幣29.5元兌一美元匯率假設，提出第三季財測展望目標。當然，雖然央行有能力撐住29.5元，但問題是在COVID-19疫情導致入出境隔離十四天政策遲遲無法解禁，運費成本的提高，售後維修服務的人員無法及時到位，這些隱形的成本提高，廠商只能自行吸收。但疫情至今已經正好滿半年，全球的確診人數卻持續創新高，加上新冠病毒早已變異，疫苗就算問世，也將類似流感疫苗般的「打心安」的作用。更何況近日中國陸續在大連、廈門、江西、雲南等地的海關，在厄瓜多冷凍白蝦的貨櫃和外包裝上都驗出新冠病毒核酸陽性，預期出口貿易還會有一段長時間將持續受到疫情而拖累。運輸有形無形成本 產能受影響日前跟運輸業的朋友聚餐，站在第一線的工作實務的觀察，原本貨物都是隨著載人的客機隨機運送，這樣的模式佔了80%，只有20%的貨品是用貨機專程運送，但如今客機航班大減，可隨機運送的貨品自然要排隊，而運輸業採用的是價高者得，漲價的幅度達到25%上下不等，之前在歐、美、日鎖國封城，運費成本增加的影響比較不明顯，但如今就算全球確診數創新高，但經濟全面復工拚第三季科技旺季，貨物運費增加的問題將顯現出來。可是問題不只是這麼簡單，以日本為例，貨品雖然運送到日本，但因防疫成果不彰，隔離政策導致後段運送的人員不足，堆積在庫，好不容易運送到位了，出了狀況，且不談客訴抱怨導致循原路退貨的運送難處，還有客訴維修的人員也可能因為防疫措施而無法承諾及時到位維修，導致產能無法發揮原有的預期。匯率升值、運費成本、交貨延期、售後維修等問題，將成為第三季業績的變數。季報，經常是題材股的大考，湊巧的是，今年兩次季報月(四月、八月)都出現股市的大震盪，三月眾所周知的美股在十天之內出現四次熔斷跌停，可以視為四月第一季的大考成績單。在歷經四、五、六月的報復性Ｖ型反彈之後，生技股在翻數倍漲幅之後，將迎來八月的半年報大考，在防疫概念搭配合一新藥授權金的助攻下，許多2015至2019年大跌的新藥股也趁機展開一波報復性的解套波，例如基亞、台微體、醣聯、訊聯、亞諾法等，大漲過後，醜媳婦終究要見公婆，導致在7月10日的上櫃生技醫療指數出現大量長黑Ｋ的Ｖ型反轉轉折訊號，上周大跌19.24%，幾乎是接近熊市的跌幅標準。撐過八月半年報大考 生醫股入冬後再戰二次疫情爆發可預期本周將測試三月以來的主上升趨勢線支撐，如果不守，下方季線支撐落在146.85點，是多頭信心的防線，萬一失守，半年線與年線交會的124.62~125.63點將是多頭寄望的最後一道防線。正所謂大破大立，撐過了半年報這一關，入冬後，生技醫療股仍有再戰二次疫情爆發的機會。(本文摘自《理財周刊 1039期》)中時新聞網對留言系統使用者發布的文字、圖片或檔案保有片面修改或移除的權利。當使用者使用本網站留言服務時，表示已詳細閱讀並完全了解，且同意配合下述規定：違反上述規定者，中時新聞網有權刪除留言，或者直接封鎖帳號！請使用者在發言前，務必先閱讀留言板規則，謝謝配合。,blue
大陸翼龍武裝無人機賣得太好 美國眼紅緊急放寬銷售限制,爭奪軍用無人機市場，中國「翼龍」系列無人機在2016年底已成功出口5個國家。美國國務院周五（24日）公布新政策，繞過有35個成員國的導彈技術控制制度（MTCR），今後向其他國家出口大型武裝無人機，以抗衡中國軍用無人機在戰場影響力。據《東網》報導，美國國務院政治軍事事務助理國務卿庫珀（R. Clarke Cooper）表示，華府引用「國家酌情權」，繞過MTCR軍控協議對出口大型武裝無人機的限制，已獲特朗普批准及即時生效。白宮指這改善美國夥伴的能力，並提升美方的經濟安全。有華府官員指出，中國不是MTCR成員國，可以出口翼龍2這類大型武裝無人機，而性能相同的美製MQ9無人機則被禁出口，令美方無法在軍用無人機市場與中方競爭。「翼龍」系列是中國具有自主知識產權的無人機產品，自2010年開始批量交付，已出口阿拉伯聯合大公國等多個國家。「翼龍」無人機出口近日又有斬獲，塞爾維亞國防部在9月10日中國高級別軍事代表團結束訪問後，宣布中國已經同意向該國出售武裝無人機，這是中國首次向歐洲國家出售武裝無人機。(中時新聞網)中時新聞網對留言系統使用者發布的文字、圖片或檔案保有片面修改或移除的權利。當使用者使用本網站留言服務時，表示已詳細閱讀並完全了解，且同意配合下述規定：違反上述規定者，中時新聞網有權刪除留言，或者直接封鎖帳號！請使用者在發言前，務必先閱讀留言板規則，謝謝配合。,blue
防惡意活動 美國國土安全部增設大陸工作組,中美緊張情勢升級，美國國土安全部（DHS）於美東時間24日在官方網站發文宣布，已設立「中國工作組」。香港信報報導，美國國土安全部代理部長沃爾夫（Chad Wolf）主持工作組的成立會議。沃爾夫表示，中共在貿易、網路安全、移民及智慧財產權方面的惡意活動正以驚人的速度加劇，國土安全部處於遏止相關行動的最前線，中國工作組將優先處理美國所面臨的威脅。美國國土安全部同時列出一系列近期所採取的行動，包括針對來自中國的假消息，與各級地方政府合作；拒絕高風險中國研究生入境；沒收非法製造商的病毒測試劑及口罩；拒絕與壓迫新疆民眾有關的中國商品進入市場；以及攔截來自中國的非法藥物。(工商 )中時新聞網對留言系統使用者發布的文字、圖片或檔案保有片面修改或移除的權利。當使用者使用本網站留言服務時，表示已詳細閱讀並完全了解，且同意配合下述規定：違反上述規定者，中時新聞網有權刪除留言，或者直接封鎖帳號！請使用者在發言前，務必先閱讀留言板規則，謝謝配合。,blue
曹若梅》讀歷史只能靠追劇,追劇圈粉，邁入5G時代的新趨勢，這是休閒娛樂而非教育，相信大家都同意；遺憾的是，在新課綱的規範下，高中歷史課本把中國史納入東亞史，中國歷朝歷代的時序發展、政治演變、文化成就和重要人物全都變成斷簡殘篇，因為課本的編輯主旨是把中國和日本、朝鮮、越南並列，所以學生必須學習這幾個地區的歷史，例如歷史大事年表的分項標題是：「東亞大陸及朝鮮半島」、「日本列島」、「中南半島及南洋群島」，「中國」二字徹底消逝無蹤。對於十多歲的高中生而言，號稱培養思辨能力的主題式教學，其實施前提必須是架構在完整的基礎觀念，也就是時間軸系統，才有可能進行更深入的素養訓練；令人震驚的是，國中8年級即將實施的中國史課本，內容被刪減得更是慘不忍睹，寥寥數語就交代了商朝以前的歷史文化，接續以兩個單元闡述商周到隋唐，這兩千多年期間的政治發展和東西文化交流。於是，三皇五帝、大禹治水、武王伐紂、周公東征、楚漢相爭、王莽篡漢，乃至於三國時期的人事物全部消失殆盡，隋朝的大運河、唐朝的武則天、唐明皇、明朝的張居正、李時珍、清朝的太平天國，全都默默退場。以後的學生或許對「周公恐懼流言日，王莽謙恭下士時」不知所云，也不明白「挾天子以令諸侯」的由來是曹操，「一騎紅塵妃子笑」是指楊貴妃嗜吃荔枝…。難不成真的要從影視作品中汲取歷史知識嗎？眾所周知，為了增加劇情張力而編導的歷史劇並非正史，戲劇為了煽情，不乏杜撰虛構、添枝加葉，甚至不符史實的情節，這絕非正當的教育管道。但是教科書受限於新課綱，出版社在製編時被要求：第一、二單元的圖文不能超出4個頁面，名義上是以略古詳今的重點式論述，減輕學生的學習負擔，但細節裡所暗藏的意識形態，自是不言而喻；若是對照7年級歷史課本，關於日本在台統治期間的敘述，一間百貨公司、一家西餐廳、一座公園都要圖文並茂的詳細介紹，教育當局的目的為何，想要操弄的又為何？應該無需贅言，「司馬昭之心路人皆知」，可惜大家不知司馬昭，因為三國人物在新課本全部蕩然無存。此外，由於新課綱對於課程架構做了調整，授課時數縮減，卻將原屬於八年級下學期的兩個篇章置入本冊，導致教師在極其有限的時間內，不僅難於額外補充，甚至被迫以跳躍式授課，讓學生囫圇吞棗：例如刪了安史之亂和黃巢之亂，大唐政權突然不了了之；少了陳橋兵變，黃袍加身，宋朝突然躍於眼前；缺了明成祖的「靖難之變」，紫禁城突然變成權力核心。某一版本在「商周至隋唐時期的國家與社會」單元中，只出現秦始皇一個人名，真不知今夕是何夕，竟把教學當兒戲，往後不只曹操無人識，年輕世代的文化價值認同恐更危矣！（作者曾任國中歷史教師、國立編譯館國中歷史教科書編輯委員）中時新聞網對留言系統使用者發布的文字、圖片或檔案保有片面修改或移除的權利。當使用者使用本網站留言服務時，表示已詳細閱讀並完全了解，且同意配合下述規定：違反上述規定者，中時新聞網有權刪除留言，或者直接封鎖帳號！請使用者在發言前，務必先閱讀留言板規則，謝謝配合。,blue
指外國近4000名間諜潛伏！大陸以牙還牙 關美駐成都總領館,美國21日無預警宣布限大陸72小時內關閉駐休士頓總領事館，大陸外交部24日祭出反制措施，決定撤銷對美國駐成都總領事館的設立和運行許可。大陸官媒新華社稱，此舉是「被迫反制，美方要負全責」。大陸外交部發言人汪文斌24日在例行記者會上打開天窗說亮話，指美國外交官「從事與其身分不符的活動」。聲稱被迫反制 要美負全責美方「72小時關閉駐休士頓領事館」的大限未至，大陸外交部24日上午向外界展現何謂「中方必將作出正當和必要反應」，決定撤銷美國駐成都領館，並稱「中方舉措是對美方無理行徑的正當和必要反應，符合國際法和國際關係基本準則，符合外交慣例。」大陸外交部發言人汪文斌指控，「美駐成都總領館的一些人員從事與其身分不符的活動，干涉中國內政，損害中國的安全利益。中方多次就此提出交涉，美方對此心知肚明。外交是講對等的。」汪文斌的回答意有所指。據法新社2015年一則報導披露，成都可能存在4000名左右為外國情報機構服務的間諜，名列十大間諜城市之一。在2016年軍改前，成都還是大陸一級大軍區成都軍區的所在地，也是大陸三大核武器管轄中心，軍事地位至高無上，不少外國特工以刺探成都軍事情報為動力而潛伏成都。美國駐成都總領事館成立於1985年，領區範圍覆蓋大陸的西南地區，包括四川、雲南、貴州、西藏自治區和重慶，具有重要的戰略意義。陸媒指，美國駐成都總領館，共有200多名員工，設有政治處、安全處、經濟處、簽證處、新聞文化處、農貿處、商務處、行政處等部門。白宮促陸 勿針鋒相對報復「是美方霸凌挑釁在先，中方被逼無奈反制在後，責任完全在美方」，新華社昨發文細數美國近期對大陸的各種打壓，批美在中美關係挑起事端「已到了歇斯底里的地步」，指美國將新冠病毒稱為中國病毒、動用國家機器打壓陸企、對陸駐美使館炸彈威脅、無端打壓中國媒體駐美機構等。白宮24日敦促中方不要因美方關閉中國駐休士頓領事館，而進行「針鋒相對的報復」，要求關閉美國駐成都總領事館。白宮國家安全委員會發言人尤利奧特說，關閉休士頓中國總領事館，是為了保護美國的智慧財產權和美國人的私人信息。「我們敦促中共停止這類惡行，而不是進行針鋒相對的報復。」中時新聞網對留言系統使用者發布的文字、圖片或檔案保有片面修改或移除的權利。當使用者使用本網站留言服務時，表示已詳細閱讀並完全了解，且同意配合下述規定：違反上述規定者，中時新聞網有權刪除留言，或者直接封鎖帳號！請使用者在發言前，務必先閱讀留言板規則，謝謝配合。,blue
反制港版國安法 美斷港特殊待遇,在中美互撤對方使館劍拔弩張之際，美國國務院當地時間23日在Facebook發表貼文，表示美國總統川普即刻起對香港實施與中國大陸同等對待（Hong Kong will now be treated the same as mainland China），即香港不再享有特殊待遇。此外，川普同日在白宮疫情簡報會上再度控訴中國傳播新冠肺炎病毒，導致全球經濟崩盤，他更直言，中美貿易協議現在對他而言意義不大。港版國安法立法後，美國兩院火速通過「香港自治法」，並於本月14日交由川普簽署並宣布相關措施，取消美國給予香港貿易上的特殊地位。川普當時指出，香港市民的自由和權利已經被剝奪，因此在貿易上不會再把中國大陸和香港分開來。他說，美國在未來看待香港的時候「將與中國大陸沒有分別」。美國務院23日PO文重申，川普現在對香港與中國大陸一視同仁，香港沒有特權、沒有特殊經濟待遇，美國也不再出口敏感技術至香港。此外，川普同日出席簡報會時抱怨，美國必須實施經濟封鎖才能預防新冠肺炎病毒。「比起當初達成的貿易協議，現在的貿易協議對我而言意義小得多。」對於近期中國創紀錄購買玉米、大豆等美國農產品，川普說：「他們這麼做的意義已經不大了。」根據美國農業部23日公布的數據，7月16日當周，中國訂購美國玉米196.7萬噸，為有紀錄以來最大單周玉米購買量。同時該周美對中輸出大豆169.6萬噸，為2019年3月以來最高水平。美國務卿蓬佩奧則在23日下午於加州美國前總統尼克森紀念圖書館發表演說時呼籲，全球要聯手改變中國共產黨的行為。他說：「全球的自由國家，必須以更有創造性和自信的方式引導中國共產黨改變其行為，因為北京的行為威脅到我們的人民和我們的繁榮。」蓬佩奧說：「在中國改變之前，世界不會安全。因此，我們的目標，應該是誘發（中共）變化。」蓬佩奧提及台灣，他說，「我們將台灣友人邊緣化，台灣後來發展出蓬勃的民主；我們給予中共及其政權本身特殊經濟待遇，卻只見中共堅持要求對其人權侵害情形噤聲，才准西方企業進入中國」。他強調，自由世界曾打敗過強權，如今必須再次對抗強權中國。中時新聞網對留言系統使用者發布的文字、圖片或檔案保有片面修改或移除的權利。當使用者使用本網站留言服務時，表示已詳細閱讀並完全了解，且同意配合下述規定：違反上述規定者，中時新聞網有權刪除留言，或者直接封鎖帳號！請使用者在發言前，務必先閱讀留言板規則，謝謝配合。,blue
蓬佩奧新鐵幕演說 籲改變中共,美陸關係急劇惡化之際，美國國務卿蓬佩奧23日於加州尼克森總統圖書館發表演說，直接劍指中國共產黨炮火全開，他稱美國近50年來推動的接觸政策，並未改變中共馬列政權本質，他敦促盟邦合力對抗「新的暴政」，還呼籲大陸人民加入改變中共的行為。蓬佩奧的演說，讓華府對陸批判聲浪達到新高，被形容是「討共檄文」、「新鐵幕演說」。批陸愈來愈專制好鬥這場演說題為「共產中國與自由世界的未來」。蓬佩奧指出，當年尼克森總統開啟對陸接觸政策，是認識到「中國實在太重要了，不能被忽視」，而過去美國政府向大陸示好，也是希望「引導改變」，但「今日的中國卻在國內愈趨專制，在海外越發好鬥、敵對。」盲目接觸模式不延續蓬佩奧表示，接觸政策並未改變中共的馬列政權本質，而且給北京帶來了好處。他還提到，美國在推動這一政策的過程中，「把我們在台灣的朋友邊緣化，而台灣後來成長為一個生機勃勃的民主政體。」蓬佩奧說，華府會繼續與北京對話，但必須對中共採取「不信任，而且要核實」的態度。他稱，「與中國盲目接觸的舊模式已經失敗。我們絕不能延續。」蓬佩奧強調，美國再也不能忽視美陸兩國的根本不同，他說：「我們必須記住，中國共產黨是馬克思列寧主義政權，習近平總書記是破產的極權意識形態的忠實信徒。他的意識形態反映他幾十年來尋求建立在中共基礎上的全球霸權。」蓬佩奧從政治、經濟和軍事等方面，列舉了大陸種種破壞全球民主秩序的作法。他說，中共領導下的大陸不能再被視為「正常國家」，並敦促志同道合的國家組成一個「新的民主聯盟」，「自由世界必須戰勝新的暴政」。蓬佩奧還呼籲大陸人民加入行列，來改變中共的行為。他稱，美國「也必須接觸中國人民並賦予他們力量」。美前助卿批咆哮無用蓬佩奧的這場演說，被美媒形容是「美中意識形態兩軍對壘」，也有分析人士指其為「討共檄文」，英國廣播公司（BBC）則稱是開啟新一場冷戰的新鐵幕演說。不過，美國前亞太事務助理國務卿羅素卻毫不客氣地批評，蓬佩奧的演說是「冗長的意識形態咆哮」（extended ideological rant），只會招致反效果，對改變大陸政府行為沒有幫助。中時新聞網對留言系統使用者發布的文字、圖片或檔案保有片面修改或移除的權利。當使用者使用本網站留言服務時，表示已詳細閱讀並完全了解，且同意配合下述規定：違反上述規定者，中時新聞網有權刪除留言，或者直接封鎖帳號！請使用者在發言前，務必先閱讀留言板規則，謝謝配合。,blue
