title,content,answer
後疫情時代綠色轉型方向 北科大產學聯盟辦論壇,引領企業綠色轉型，臺北科技大學國際產學聯盟、管理學院EMBA、EMBA校友會日前聯合以「推動循環經濟與永續發展的挑戰與對應」為題，主辦後疫情時代永續新未來論壇，工業局長呂正華、歐洲在台商務協會理事長尹容（Giuseppe Izzo）、歐萊德國際副總經理周曉鳴、中經院綠色經濟研究中心副主任林俊旭等產官學研重量級人士共同探討循環經濟的政策、商業模式及科技創新，推動人才培育與傳承，提供企業在後疫情時代的綠色轉型新方向。本次論壇協辦單位中國生產力中心提供中英文線上直播服務，讓近百名來自泰國、越南、馬來西亞等地的台商企業及當地政府、智庫，即時聆聽台灣推展循環經濟的經驗，促進我國綠色政策輸出，強化新南向之國際合作與綠色貿易商機。北科大校長王錫福指出，全球經濟活動因疫情影響大幅衰退，當疫情緩和後，應由完整的政策架構及經濟誘因引導企業邁向綠色轉型，企業要有決心盡速融入全球綠色供應鏈，創新綠色技術。北科大在綠色技術創新有許多研發成果，包括綠色創能、儲能、節能、材料、廢棄物回收再利用、綠建築、循環設計等創新商業模式，更將成立跨領域的技術研究院，以校內優勢將「能源」及「智慧感測」列為發展主軸，緊扣聯合國的17項永續發展指標，實踐北科大的大學社會責任。工業局長呂正華表示，台灣30年來積極推動循環經濟，目前工業廢棄物再利用綠達80％、資源再生產業產值達734億元，更有許多成功的產業共生案例，如臨海工業區能資源整合成效卓越，每年減少二氧化碳排放量超過38萬公噸。中時新聞網對留言系統使用者發布的文字、圖片或檔案保有片面修改或移除的權利。當使用者使用本網站留言服務時，表示已詳細閱讀並完全了解，且同意配合下述規定：違反上述規定者，中時新聞網有權刪除留言，或者直接封鎖帳號！請使用者在發言前，務必先閱讀留言板規則，謝謝配合。,blue
疫情烏雲壟罩 投資新創資金縮水,新冠疫情持續發威下，投資人風險胃納變小，對注資仍是未知數的新創事業裹足不前。今年上半北美科技新創公司募集的創投資金明顯縮水，對這些IT創新主要來源的發展很不利。根據分析機構Crunchbase編纂的資料，今年上半，對美國和加拿大新創企業的總投資額約莫640億美元，相較去年同期下滑10％。Crunchbase指出，整個季度都籠罩在疫情之下的第二季，新創公司籌資金額比第一季少了12％不到300億美元，與去年同期相比下滑18％。Crunchbase提到，第二季新創企業成功爭取到的投資案，規模在1億美元左右的占絕大多數，而且主要流向趨於成熟的新創公司。該季最大一筆新創投資案，是谷歌母公司Alphabet旗下自駕車部門Waymo，3月向私募基金銀湖（Silver Lake）領銜的外部投資人募得22.5億美元。儘管今年上半大型新創投資案成交件數，與去年同期一致，但金額在1億美元以下的件數，較去年同期滑落31％。第二季的早期階段新創企業投資案成交量，下滑到約莫700件，不到第一季數量的一半。新創企業創辦人及主管指出，疫情當道之下，投資人對於注資新創公司和未經檢驗的技術有所疑慮，寧可打安全牌將資金投入已做出成績的企業。線上付款軟體開發商Fast執行長霍蘭德（Domm Holland）表示，「當前尋求籌資的時機糟糕透頂。」他列舉幾個讓投資人望之卻步的原因，包括近來新冠肺炎確診數又見激增、經濟不確定性升高、無法與潛在金主面對面。不過有新創企業在疫情危機中趁勢崛起，開發先進線上支付工具或企業網路平台等熱門技術，投資人表示他們正在找尋金援這類新創公司的機會。雲端技術新創企業DigitalOcean執行長史博威（Yancey Spruill）指出，投資人多鎖定能迎合客戶立即需要的新創企業。中時新聞網對留言系統使用者發布的文字、圖片或檔案保有片面修改或移除的權利。當使用者使用本網站留言服務時，表示已詳細閱讀並完全了解，且同意配合下述規定：違反上述規定者，中時新聞網有權刪除留言，或者直接封鎖帳號！請使用者在發言前，務必先閱讀留言板規則，謝謝配合。,blue
後疫情時代加上高溫 市議員謝志忠建議參觀潭子書畫展,後疫情時代，各旅遊景點都湧現大批人潮，加上氣溫居高不下，炎炎夏日不如到豐原葫蘆墩文化中心，看看台中市潭子書畫展，即日起至8月23日；台中市議員謝志忠說，同時也展出生態探索解說，一樣很棒喔！謝志忠說，台中市潭子書畫展中，陳世傑理事長及徐老師，這對夫妻是他的老鄰居，走路10秒就會到的好鄰居，看他們從教育界退下來，完全投入最有興趣的藝文及生態探索解說，真是退而不休；找到生命最有意義的出口，這應該也是退休人員的典範。謝志忠表示，還有好久不見的陳勇仁大哥，當時他們都搞體育運動，今天再見面，卻在葫蘆墩文化中心的書畫展，他告訴我，59歲以後戒掉小酌，就開始學書法，其中，心性的改變，令人佩服；如今常常寫作，四處參展，怡然自得。(中時 )中時新聞網對留言系統使用者發布的文字、圖片或檔案保有片面修改或移除的權利。當使用者使用本網站留言服務時，表示已詳細閱讀並完全了解，且同意配合下述規定：違反上述規定者，中時新聞網有權刪除留言，或者直接封鎖帳號！請使用者在發言前，務必先閱讀留言板規則，謝謝配合。,blue
疫情期間 凱柏 加強內部管理、邁向5G,歷經半年的新冠疫情（COVID-19）影響，打亂全球工具機市場，國內的工具機業也深受影響，凱柏精機公司在疫情期間除了加強內部管理，也朝向智慧製造及邁向5G快速時代加工服務，凱柏公司永遠站在科技實現工具機業，科技製造無人化智慧生產系統。凱柏公司董事長蔡清哲表示，在疫情期間許多產業風雲變色，能繼續經營的都是大家齊心合力的成果，凱柏更利用這段時間做好營運面的規劃，強化產品開發及工具機產業人才培育計畫等，在全球的商業活動減少的情況下，公司內部的應變要更靈活更有張力。蔡清哲指出，近來隨新冠病毒疫情延燒，顛覆人類習慣的生活及工作方式，工研院產經中心（IEK）更指出，AI、5G等數位科技，將讓「零接觸經濟」轉換成「零距離創新」，衍生新體驗式服務與商業模式，因此凱柏今年度將把數位科技導入新產品五軸機的開發，搭配周邊管理設備聯網，讓客戶奠定數位技術良好的基石。今年凱柏將推出三款不同應用的五軸機，針對有場地限制與中小型加工件推出 Table-Table型態，中大型量產工件建議採用 Table-Head型態，大型工件適合Head-Head型態的五軸機型，建立完整的五軸機產品線，涵蓋O170mm到最大O1,250mm的零件尺寸，加上凱柏經驗豐富的應用技術團隊，協助客戶挑選出最適合的五軸機，有效提高生產效率。進入5G快速時代，工具機業智慧製造也要跟著提升，為迎接製造業服務化之快速應變市場能力需求，凱柏基於自有的IIoT系統，新推出智慧倉儲系統，可大幅降低客戶倉儲成本，補料簡易，以販賣機無人派駐的概念，提供24小時即時供應領料需求，結合IIoT系統主動再訂購提示，精準物料用量分析，達到無人化生產，讓原本的倉儲員進行更有效益的工作。包含刀片、刀桿等各式物料管理，利用智慧倉儲系統，連結到各機台與產線，達到廠房全數位化運作及監控。老闆可針對物料作綜效管理，隨時掌握用量之波動，並分析進行下一步決策。數位化讓工具機產業自此進入新時代，在此變局中，產品面之研發必須加速朝向高階應用領域，凱柏將利用上述「智慧機械×倉儲管理IIoT×工廠數據分析×行動平台監控」綜合功能，輔助客戶跨地區、跨時區掌控生產線，管理工廠稼動率與監控設備總合效率，實現科技製造無人化智慧生產。網址：www.campro.com.tw。中時新聞網對留言系統使用者發布的文字、圖片或檔案保有片面修改或移除的權利。當使用者使用本網站留言服務時，表示已詳細閱讀並完全了解，且同意配合下述規定：違反上述規定者，中時新聞網有權刪除留言，或者直接封鎖帳號！請使用者在發言前，務必先閱讀留言板規則，謝謝配合。,blue
疫情助長單身經濟 獨食在陸正夯,一個人吃飯，過去在大陸的餐廳可不是件容易的事，但最近市場已經逐漸重視個人用餐的商機。一場新冠肺炎疫情之後，單身經濟更夯，杭州農貿市場推出了專門針對一個人的套菜，讓單身者可安心在家煮食；一人食的火鍋店也有不少，小的座位，有點像格子間，一字排開；有156年歷史的北京全聚德烤鴨店，近日也推出一人食烤鴨餐。杭州鳳起路農貿市場43歲賣菜的王大姐推出了專門針對一個人的套菜，一套35元（人民幣，下同），內容有排骨，有蔬菜，還有米和調味料，對單身人士來說，可以說很貼心了。「一人食最掌握不好菜量，買多了放著不新鮮，浪費；買少了又不夠吃。」家常菜 方便年輕人料理為什麼推出單身套菜？王大姐說，她住蕭山，鄰居是個姑娘，在濱江上班，下班之後就點外賣。「我跟小姑娘說，不要吃外賣不健康。小姑娘說，一個人做飯太煩了。我就在想，我正好賣菜，可以給她帶一點，做點方便的菜吃吃。」正是受到這個啟發，王大姐才想到了單身套菜。在消費券推出那時期，她推出「單身套菜」，一個套菜35元，有半斤（250克）排骨、兩個雞蛋、一個番茄、一顆大生菜、兩三根小茄子、三兩米、油鹽醬醋一組、一個大蒜一塊生薑，葷素搭配。王大姐說，原本套菜活動是迎合消費券推出的，現在已經沒有這套菜了，但是如果年輕人想要配一套，她也可以幫忙配好。不僅年輕人，老人家也有來買的。她說，她配的菜都是簡單的家常菜，廚藝不好的人買回去自己做也毫無壓力。格子間火鍋 顧客多女性在杭州有不少家一人食的火鍋店，小小的座位，有點像格子間，一字排開，一共有15個，高高的木板遮擋著。每個座位前都有一個小簾子，那是上菜用的。一個女生一邊刷著手機一邊吃著火鍋。「我不是單身，但是也可以一個人吃呀！」她點了一份48元的單人套菜，她說，有時候朋友約不到，又不能虧待了自己，那種大的火鍋實在吃不完，這種挺好的，量也剛剛好。火鍋店的祝老闆說，顧客中有50%是一個人來的，還有一半是情侶或者朋友結伴而來，甚至有公司聚餐把小店包下來的。2019年8月，他花了30萬元開了這家店。「生意還不錯，也有網紅來拍視頻的。很多人都圖個新鮮。」顧客中七成是女顧客，而且多是漂亮姑娘，偶有男生過來。中午客人較少，晚上則是常常滿座。老字號全聚德 營運改革26日正好迎來156歲生日的北京全聚德烤鴨店，在疫情之下，老字號也不得不思考轉變營運模式來迎接新的挑戰。全聚德將啟動三大調整進行改革，調整菜品菜價、統一烤鴨製作工藝、取消服務費。全聚德菜價整體下調大約10%至15%。全聚德新菜單中還特別添加一人食烤鴨，在配備一人份烤鴨、捲餅、火燒、蘸料的同時，搭配燴鴨舌烏魚蛋湯、鹽水鴨肝、青檸脆皮蝦、養生時蔬、果汁等小份菜品，讓一人吃烤鴨也不再感覺單調。今年上半年疫情因素導致到店吃飯客流大幅減少，讓全聚德面臨更嚴峻的考驗。為降低損失，今年2月初開始，全聚德部分門店在第三方平台上線了外賣業務，外賣菜品中包含老北京酥香丸子、五香醬鴨、鴨粒炒飯等30多種菜品供消費者選擇，還加入了適合單人食用的小份菜和特色套餐。中時新聞網對留言系統使用者發布的文字、圖片或檔案保有片面修改或移除的權利。當使用者使用本網站留言服務時，表示已詳細閱讀並完全了解，且同意配合下述規定：違反上述規定者，中時新聞網有權刪除留言，或者直接封鎖帳號！請使用者在發言前，務必先閱讀留言板規則，謝謝配合。,blue
拜登尾盤拉高 川普鐵票生鏽！疫情拖垮選情 川普反中牌失靈,美國11月3日總統大選進入倒數100天的最後衝刺階段，不同於以往多半圍繞經濟議題打轉，今年則完全被疫情主導，由於現任總統川普防疫表現荒腔走板，民調直直落，不得不加碼猛打反中牌，甚至出招關閉大陸駐休士頓總領事館，讓美中關係大開倒車。不過根據最新民調顯示，一系列反中牌既無助控制疫情，也難救他低迷選情，繼續以2位數差距遙遙落後於對手拜登之後，就連共和黨鐵票倉的佛羅里達州都已由紅轉藍。假如現在就舉行選舉，民主黨候選人拜登可望拿下400張選舉人票（門檻為270張），入主白宮。專家更直言，除非疫情反轉，否則川普難像2016年一樣，爆冷逆轉勝。川普淨支持率 史上最低根據美國有線電視新聞網（CNN）25日公布的民調，民眾對川普施政滿意度為40%，不滿意度高達55%，淨支持率為-15％。分析指，美國自1940年以來，沒有總統能以這差績連任成功。即使是已故前總統杜魯門1948年尋求連任時，滿意度為-6%，支持率也比川普高出近10個百分點。民調顯示，拜登已在多個搖擺州領先川普，或與川普呈現拉鋸。其中阿拉斯加、猶他、南卡、印第安納、蒙大拿、密蘇里、堪薩斯等7州，拜登都已縮小與川普的差距至個位數。由於7州中有4州的共和黨參議員要改選，民主黨說不定能重新入主白宮之外，還可望奪回參議院控制權。在疫情急劇惡化的佛州，拜登以51%支持率小勝川普的46%。在亞歷桑納州，兩人支持率是49%對45%，都已縮小至個位數。在密西根，拜登則是大贏12%，大抵符合全國性民調。防疫漏洞百出 鐵粉流失紐約時報分析指出，這主要是川普防疫表現漏洞百出，大幅流失中高齡白人男性等傳統共和黨鐵粉的支持之故。而這也可以從賓州、密西根州、威斯康辛州（也就是2016年讓希拉蕊與白宮寶座失之交臂的三大戰場）的民調都已由紅轉藍得到印證。缺乏具體政見 拜登隱憂不過距今選舉還有三個多月，尚有很多選民未決定投票給誰，選情依舊存在變數。專家稱，如果疫情趨緩或是經濟反彈，仍可望為川普選情注入活水。再者，萬一國家發生大型災難或是最高法院大法官空出一個位子，都可能點燃選民的情緒與意識形態之爭，進而造成翻盤。拜登也不是沒有隱憂。失去鎂光燈焦點的他，難得有上新聞版面的機會，加上缺乏具體政見，又已77歲高齡，讓他很難贏得年輕、改革派的支持。這些人或許不會轉向川普，但更可能放棄投票。中時新聞網對留言系統使用者發布的文字、圖片或檔案保有片面修改或移除的權利。當使用者使用本網站留言服務時，表示已詳細閱讀並完全了解，且同意配合下述規定：違反上述規定者，中時新聞網有權刪除留言，或者直接封鎖帳號！請使用者在發言前，務必先閱讀留言板規則，謝謝配合。,blue
《經濟》景氣連4亮黃藍燈 國發會：疫情衝擊趨緩,國發會今公布6月景氣燈號，受新冠肺炎疫情影響，燈號已連續4個月呈現代表景氣趨弱的黃藍燈；國發會表示，景氣同時指標持續下跌，惟跌幅較上月略減，加以領先指標經回溯修正後呈連續2個月上升，反映疫情衝擊影響已漸縮減，惟仍須密切關注後續發展。國發會公布，109年6月景氣對策信號綜合判斷分數為19分，與5月上修值持平，燈號續呈黃藍燈。5月綜合判斷分數上修1分，為19分，主要係因製造業銷售量指數之燈號由藍燈上修為黃藍燈，增加1分。6月為19分，與5月上修值持平，燈號續呈黃藍燈。9項構成項目中，貨幣總計數M1B由綠燈轉呈黃紅燈，分數增加1分；機械及電機設備進口值由黃紅燈轉呈綠燈，分數減少1分。國發會表示，景氣同時指標持續下跌，惟跌幅較上月略減，加以領先指標經回溯修正後呈連續2個月上升，反映疫情衝擊影響已漸縮減；6月景氣領先指標不含趨勢指數為100.01，回到100以上，且較5月續升0.5%。國發會表示，近期全球武漢肺炎(COVID-19)疫情再次升溫，加上主要國家政經衝突持續升高，深化國際經濟局勢震盪與風險，恐影響全球最終需求，壓抑我國外貿擴張。惟5G通訊、高效能運算等新興應用快速成長，以及遠距商機需求延續，且廠商回台擴充產能支撐，有助維繫出口動能。此外，國內疫情控制得宜，民眾與企業對未來景氣看法改善，激勵股市上揚，工業生產指數、機械及電機設備進口持續成長，消費人潮明顯回流，帶動零售及餐飲業表現均較5月持續回升。加以政府全面啟動振興措施，如推動「振興三倍券」、「安心旅遊」等，可望發揮提振經濟之效果，同時，政府持續加強推動公共建設計畫，以發揮穩定景氣效益。考量當前全球經濟前景仍相當嚴峻，為協助艱困產業度過疫情衝擊，政府已編具紓困振興特別預算第2次追加預算，以持續推動紓困與振興工作，並確保我國經濟情勢穩定。(時報資訊)中時新聞網對留言系統使用者發布的文字、圖片或檔案保有片面修改或移除的權利。當使用者使用本網站留言服務時，表示已詳細閱讀並完全了解，且同意配合下述規定：違反上述規定者，中時新聞網有權刪除留言，或者直接封鎖帳號！請使用者在發言前，務必先閱讀留言板規則，謝謝配合。,blue
疫情影響 呷拜拜轉型藝文節,宜蘭大拜拜是今年由宜蘭東嶽廟主辦，但受到新冠肺炎疫情影響，取消「辦桌呷拜拜」活動，隨疫情趨緩，廟方決定在8月1、2日舉辦「舊城東嶽藝文節」。廟方規畫親子活動，8月1日舉行創意彩繪比賽，文化活動上有神將體驗營，由東嶽廟信義會帶領大家體驗神將文化，融合街舞橋段與北管樂曲，讓神將、街舞、北管樂演出傳統表演的新篇章。藝文節還邀請宜蘭市公所創新育成中心廠商廣生藥房，讓民眾體驗早期的「求藥籤」，廣生藥房復刻求藥籤服務，讓大家認識已消逝在廟宇與藥房之間的文化。宜蘭市長江聰淵說，市公所與宜蘭東嶽廟共同舉辦「舊城東嶽藝文節」，讓鄉親與小朋友在暑假期間體驗宗教活動，讓過神將體驗、公仔彩繪等趣味方式，讓人歡喜地學期宗教文化，歡迎鄉親蒞臨參與，體驗我們的宗教、文化與宜蘭特色。(中時 )中時新聞網對留言系統使用者發布的文字、圖片或檔案保有片面修改或移除的權利。當使用者使用本網站留言服務時，表示已詳細閱讀並完全了解，且同意配合下述規定：違反上述規定者，中時新聞網有權刪除留言，或者直接封鎖帳號！請使用者在發言前，務必先閱讀留言板規則，謝謝配合。,blue
疫情爆發 越南從峴港撤離8萬人,越南重要觀光景點峴港周日出現3位當地居民確診新冠肺炎病例後，越南政府周一表示正從峴港撤走8萬人，當中大部份是越南旅客。越南在4月出現首宗社區感染病例後，對疫情的任何變化都十分緊張。因此周日在峴港和附近出現3宗社區感染病例後，讓越南政府立即高度戒備。政府表示，這次撤離行動至少要花4天時間來進行，因為要每天安排高達100個航班，把民眾從峴港送往其他11個越南城市。這些被撤離的民眾必須進行14天居家隔離。越南實施嚴厲的隔離措施，並在疫情期間積極地做廣泛性的檢測，因此讓其從疫情爆發到周日止，累計確診數僅420人，沒有人因此死亡。相對於許多國家的疫情來看，越南疫情並不嚴重。目前越南仍然禁止外國旅客入境，但由於航空公司降價促銷，飯店業者也推出許多優惠方案，因此越南國內旅客人數激增。(工商 )中時新聞網對留言系統使用者發布的文字、圖片或檔案保有片面修改或移除的權利。當使用者使用本網站留言服務時，表示已詳細閱讀並完全了解，且同意配合下述規定：違反上述規定者，中時新聞網有權刪除留言，或者直接封鎖帳號！請使用者在發言前，務必先閱讀留言板規則，謝謝配合。,blue
疫情警訊！國內出現一「疑似」本土病例,中央流行疫情指揮中心27日表示，我國於今午接獲泰國官方通知，確診1名自我國入境確診者。指揮中心發言人莊人祥表示，經初步瞭解，此是我國北部工作之泰籍移工，21日自我國搭機返泰，25日確診，「不排除為本土病例」。莊人祥進一步表示，雖然是今天中午剛獲知此訊息，但初步已知該確診者在台所服務的公司內「另有8名泰籍員工」，公司也有其他台灣員工，而該確診者在公司宿舍內，也有同住室友，其餘細節正進行疫調之中。莊人祥強調，「該確診者不排除為本土病例！」台灣最近一起的本土病例為4月12日所發佈的「案386」，為20多歲男性，為案195(自美國境外移入)之同住友人，有過敏症狀，於案195確診後列為接觸者，進行居家隔離後確診。至今日（7月27日）已間隔106天。(工商 )中時新聞網對留言系統使用者發布的文字、圖片或檔案保有片面修改或移除的權利。當使用者使用本網站留言服務時，表示已詳細閱讀並完全了解，且同意配合下述規定：違反上述規定者，中時新聞網有權刪除留言，或者直接封鎖帳號！請使用者在發言前，務必先閱讀留言板規則，謝謝配合。,blue
