title,content,answer
抗議陳菊！蔣萬安曝「5戰將」合照 上萬網友大讚 ,國民黨立院黨團近日佔領主席台，抗議監察院長被提名人陳菊不適任，杯葛議事進行，但民進黨團仍表示將在明天17日院會行使人事同意權投票。而藍委蔣萬安也曬出徹夜堅守議場的照片，以行動證明不同意陳菊的提名案，照片一出也吸引上萬名網友按讚。藍營立委近日攻佔立院，主張「退回陳菊」，表明「陳菊不適任監察院院長」。蔣萬安16日在臉書PO出「徹夜堅守議場」的5人合照，圖片中除可見蔣萬安，還有國民黨團總召林為洲、立委洪孟楷、鄭正鈐等人。台北市議員徐巧芯昨(15日)也在臉書說明國民黨抗議原因，「監察院長與民選首長的任期不同，將一次擔任6年的時間，身為一個有可能跨政權的首長，應選擇政黨色彩較薄的人較為適當，而陳菊過去主政高市府時期，有多次被彈劾、糾正，且仍有相關案件正在審議，陳菊明顯不符合這個條件」。對於外界的種種質疑，陳菊在臉書上發文重申，「自己已經退出民進黨，並強調，希望能夠扮演最後一任監察院長，憲改工作結束後，將完成民主老兵的最後任務，光榮離開」。(中時新聞網)中時新聞網對留言系統使用者發布的文字、圖片或檔案保有片面修改或移除的權利。當使用者使用本網站留言服務時，表示已詳細閱讀並完全了解，且同意配合下述規定：違反上述規定者，中時新聞網有權刪除留言，或者直接封鎖帳號！請使用者在發言前，務必先閱讀留言板規則，謝謝配合。,blue
吳益政批陳菊：把高雄搞得亂七八糟 最後任期都在空轉！,民眾黨高雄市長補選候選人吳益政今發表首波競選廣告，訴求支持「默默做事的人」，不過，吳益政談到過去與監察院長被提名人陳菊互動時表示，陳菊在政治地位有褒有貶，但陳菊擔任高雄市長最後一屆任內，高雄市都在空轉。至於近期監察院長風波，吳益政說，相信陳菊面對政治現實有很多難處，他不願多對陳菊批評被政治解讀，強調「永遠尊敬她、尊重她的選擇」。陳菊被提名為監察院長引發爭議，外界質疑，陳菊擔任高雄市長任內，市府有多件遭監察院糾正、彈劾案，因此，陳菊不適任監察院長。吳益政今以高雄在地觀點談論陳菊。吳益政首先肯定陳菊於擔任高雄市長支出交出政見成績單，是高雄的黃金時代，不論黨派、公務員、公民團體都對高雄有「光榮感」，只要願意對高雄做事都是一家人。不過，陳菊擔任高雄市長最後一屆任期，不再傾聽民意，像是日式宿舍古蹟被拆等，環保、文化等政策都倒退走，陳菊開始「走鐘」。吳益政說，陳菊很疼惜自己的助理們，很多年輕人都跟著她，但陳菊培養的支持者除少部分很優秀，大部分都在爭權奪利，把高雄搞得亂七八糟，最後4年高雄市都在空轉。吳益政強調，身為陳菊忘年之交的朋友，對於陳菊近期陷入監察院長被提名爭議，他沒有權力質疑是否適任，因為不想因為自己的建議被政治解讀，所以他不願對陳菊多做批評，「我永遠尊敬她、永遠尊重她的選擇」。(中時 )中時新聞網對留言系統使用者發布的文字、圖片或檔案保有片面修改或移除的權利。當使用者使用本網站留言服務時，表示已詳細閱讀並完全了解，且同意配合下述規定：違反上述規定者，中時新聞網有權刪除留言，或者直接封鎖帳號！請使用者在發言前，務必先閱讀留言板規則，謝謝配合。,blue
慶富喬地案 黃紹庭要求將陳菊移送監院,前高巿府海洋局長王端仁因慶富喬地案，上月遭公懲會判決申誡，市議員黃紹庭16日總質詢，認為王端仁喬地錄音檔中多次提及的「長官」，就是現在被提名為監察院長的前巿長陳菊，要求代理巿長楊明州將陳移送監院調查。楊明州回應，王端仁是因行政程序外之接觸，未依規定作成書面紀錄，而遭懲戒。菊系巿議員簡煥宗稍後質詢也回批，國民黨不斷抹黑扭曲陳菊，如果有膽就放棄言論免責權，但他也提醒，已經有3人向陳菊公開道歉過。黃紹庭指出，前海洋局長賴瑞隆曾在2014年，到廈門力邀「唐榮遊艇集團」回台投資興達港，但本來可望召開的初審會，高巿府卻莫名奇妙的兩度擋下，甚至在政策需求評估會議上，地主漁業署也都同意讓廠商補件辦理。他指出，當時慶富若未能在2017年6月前取得造船土地，將因為違反與海軍簽訂的獵雷艦採購合約，不僅會每日計算罰款，最嚴重還可解約，不過經過王端仁一喬，慶富順利在2017年5月底，與漁業署簽訂土地租賃契約。黃紹庭認為，王端仁喬地，讓慶富免於遭受罰款與解約，當然涉及龐大利益，且王端仁在錄音檔中，多次提及府內「長官」，當時巿長陳菊在駁回唐榮申請案的公文上蓋了章，且王端仁是由陳菊任命，陳菊當然有行政責任。(中時 )中時新聞網對留言系統使用者發布的文字、圖片或檔案保有片面修改或移除的權利。當使用者使用本網站留言服務時，表示已詳細閱讀並完全了解，且同意配合下述規定：違反上述規定者，中時新聞網有權刪除留言，或者直接封鎖帳號！請使用者在發言前，務必先閱讀留言板規則，謝謝配合。,blue
最新》民進黨4點35分攻進議場取得麥克風 宣讀陳菊人事案,國民黨為杯葛監察院長被提名人陳菊等人事案，自周二起佔領立院議場至今，民進黨為明日行使人事投票權，在稍早下午4點起，動員黨籍立委清場。民進黨已於4點35分搶得議場主席台麥克風，並開始宣讀討論事項。人在議場現場的時力立委邱顯智10分鐘前透過辦公室轉達，希望稍後能有機會，透過提出程序動議的方式，讓行政院長游錫堃依立法院職權行使法規定，進行實際審查，在審查程序完成後，明日再進行人事同意權的行使。民眾黨立院黨團總召賴香伶辦公室稍早也回覆，目前仍在密切注意議場動向，看稍後有無機會詢答。有關明日監察院人事案各黨投票意向，日前國民黨及民眾黨已表態不會支持。時力仍在等待發給監委被提名人問卷回覆及詢答後才會決定。但截至目前為止，仍無人回覆時力。(中時 )中時新聞網對留言系統使用者發布的文字、圖片或檔案保有片面修改或移除的權利。當使用者使用本網站留言服務時，表示已詳細閱讀並完全了解，且同意配合下述規定：違反上述規定者，中時新聞網有權刪除留言，或者直接封鎖帳號！請使用者在發言前，務必先閱讀留言板規則，謝謝配合。,blue
柯建銘：明表決監院人事合法合憲 在野黨別鬼扯,立法院臨時會明將表決監察院人事案，因審查會持續停擺，引發在野質疑強行投票將違憲。對此，民進黨立院黨團總召柯建銘強調，人事案議程均已議決通過，並經過覆議，但在野黨卻佔領議場，拒絕行駛同意權；反觀被提名人全都按時赴立院簽到樂於備詢，也合法合憲，在野黨卻作賊喊抓賊，根本是沆瀣一氣，鬼扯。柯建銘也強調，監委人事同意案已經沒有回頭路，不可能從頭說要再來審查，按規畫走明天就是表決。立法院臨時會原訂周二起審查監察院長被提名人陳菊、監委被提名人的人事案，但因國民黨團認為陳菊等人不適任，發動占領議場，期間民眾黨也出面表態讚聲，審查因而喊卡迄今。但依臨時會議程，明天仍將進入表決，因而引發民眾黨質疑，若未經審查就逕行投票，是違法違憲，呼籲蔡英文總統停止提名作業。對此，柯建銘指出，臨時會議程在6月29日已由立院院會議決通過，且經過覆議；也就是說，哪一天要做什麼事均已排定，而本周就是要審查監察院的人事案。因此，柯建銘說，無論是監察院長被提名人陳菊，還是所有監委被提名人，均按表定時間到立院並簽到，樂於接受質詢；但在野黨先是不讓他們上台備詢，後來又說未經質詢是違法、違憲，「有這種道理嗎？」他強調，在野佔領議場導致審查會無法開，責任歸誰很清楚，「最沒資格講違法、違憲的就是在野黨」。柯建銘透露，週二上午陳菊到立院接受備詢雖然受阻，但在議場後的休息室等待時，因時代力量立委邱顯智告知他說已準備題目要質詢陳菊，因此，經聯繫後，特別請邱顯智到休息室與陳菊面對面對話，時間約有半小時，陳菊這麼做就是要向在野黨展現願意對話的誠意，結果現在卻被說違法、違憲，根本是不知道自己在說什麼。柯建銘進一步以大法官釋憲文來捍衛明天表決的合法、合憲性。他說，依憲法增修條文第7條規定，監委人選由總統提名，名單送立法院同意任命，這部份蔡英文既已完成提名，也將名單送至立法院，自然沒有違憲問題。但反觀大法官第632號解釋，針對「立法院遲未行使監察委員人事同意權是否違憲？」釋憲文明確指出立院消極不行使同意權，造成監院無從行使職權，國家憲政制度遭受破壞，自為憲法所不許。換言之，立委杯葛監委人事同意案審查，才是違憲。柯建銘進一步指出，大法官第342號也解釋，立法院審議法律案，須在不牴觸憲法的範圍內，依其自訂的議事來規範。若以此角度來看監委人事同意案，就是立法院如果是「未經投票表決」，就想讓所有被提名人通過，這當然違憲；但只要最後有投票，就不會有違憲的問題。柯建銘舉例，1996年時，當時的閣揆任命需由國會行使同意權，因此，時任副總統的連戰因要兼任行政院長，依法須先到立院備詢。但當時民進黨認為副總統兼閣揆屬違憲，因而將連戰擋在國會外，「請問民進黨有說連戰違憲嗎？就是我們不讓他進入立法院，如果後來我們還指控對方不來備詢是違憲，那不就是在開玩笑嗎！」柯建銘強調，現在國民黨站領議場拒絕行使同意權，民眾黨、時代力量也跟著喊沒審查就違憲，根本是沆瀣一氣，刻意給民進黨穿小鞋，找不到題目就亂蹭聲量。柯建銘說，監委人事同意案已經沒有回頭路，不可能從頭說要再審查一次，無論如何明天就是表決。呼籲國民黨主席江啟臣要知道自己正站在歷史關鍵點，如果真要主張廢除考試院、監察院，那就公開喊說請民進黨一塊簽屬廢除考、監，翻轉思維，化干戈為玉帛，才可能真正主導這整件事，也才能挽救國民黨。(中時 )中時新聞網對留言系統使用者發布的文字、圖片或檔案保有片面修改或移除的權利。當使用者使用本網站留言服務時，表示已詳細閱讀並完全了解，且同意配合下述規定：違反上述規定者，中時新聞網有權刪除留言，或者直接封鎖帳號！請使用者在發言前，務必先閱讀留言板規則，謝謝配合。,blue
許淑華曬一張照「廢考監」 1.6萬人狂讚,立法院臨時會本週處理監察院人事案，但藍綠甲級動員爆發肢體衝突後，因國民黨立委占據主席台，並推倒發言台，陳菊無法在表定時間上台接受詢問，而國民黨也表達了「廢考監」的主張。對此，國民黨立委許淑華昨(15日)在臉書也曬出一張照片，「廢考監、拒投票」，照片一曝光，不到一天的時間，已有1.6萬名網友按讚。許淑華在臉書曬出一張議場內的照片，只見桌上立牌寫著「廢考監、拒投票」，而她則是綁馬尾、身穿牛仔褲，以側面姿勢入鏡，美照一曝光，立刻掀起網友討論。許多網友留言寫下「委員辛苦了加油」、「帶人民衝進去」、「真理愈辯愈明！加油」、「神力女超人就是在打擊邪惡之人，委員加油」。然而，據《中央社》報導，陳菊表示，廢除考監是長期存在的聲音，各黨進來形成共識，強調自己會在修憲後，遵循大法官解釋，依憲法妥善行使監察院長職權，承擔起制度轉換、銜接的重責，完成最後任務，光榮離開。(中時新聞網)中時新聞網對留言系統使用者發布的文字、圖片或檔案保有片面修改或移除的權利。當使用者使用本網站留言服務時，表示已詳細閱讀並完全了解，且同意配合下述規定：違反上述規定者，中時新聞網有權刪除留言，或者直接封鎖帳號！請使用者在發言前，務必先閱讀留言板規則，謝謝配合。,blue
新聞透視》解嚴33年 台灣民主倒退嚕,昨天是解嚴33周年，諷刺的是，最高民意機關正為了美麗島事件主角之一的陳菊陷入罕見衝突。國民黨占據議場，放棄說理，這是民主怠惰；民進黨擁抱曾誓言推翻的輾壓式立法，成為人頭比拳頭更可怕的暴力政黨，這是民主倒退。解嚴果實未能開枝散葉，無疑是這代政治領袖帶給國家最深的傷害。此次朝野衝突，癥結在於國民黨指控陳菊任高市長期間，市府遭監院立案調查逾50案，不該接掌監院。國民黨若真心認為人事案萬萬不可，那麼，比武鬥更重要的，是讓陳菊站上備詢台，用質詢證明對方的不適任，用論述證明反對的正當性，爭取人民與之站在同一陣線，就算舉手舉不過民進黨，也要有企圖心，讓反對這份監委名單的人，不只是國民黨在立院的38席票，而是全台2300萬票。但國民黨卻選擇孤守議場，沒意識到失敗者的悲鳴，從來就不會是民主進步的養分。試想，戒嚴的38年，台灣若沒有敢上街頭的行動者，老百姓等得到解嚴的那一刻嗎？此刻的國民黨，別說行動，連思想都付之闕如。同樣的，民進黨在初嘗國會過半甜美後，也走向當年喊著要推翻的一黨獨大之路；沒有過不了的法案，不想過的誰也別想過。以前說別讓國會淪為橡皮圖章，如今青出於藍，只要行政部門出個聲，立院就配合修法，沒法修就立法，把立法權當成開坦克。2009年的蔡英文說過，馬政府掌握行政權，也掌握立院四分之三席次，再由總統統合行政、立法，憲政體制已喪失制衡機制。這席話，若重播給此刻的民進黨聽，難道不會無地自容？昨天，連環團申請反空汙遊行都遭高市府駁回，這不僅是剝奪民主基本權利，更提醒百姓，當年說要將《集會遊行法》從登記制改為報備制的民進黨，在執政後，連這種最基本的民主權力都捨不得放手。所以，解嚴33周年的台灣民主快樂嗎？答案令人悲歎。中時新聞網對留言系統使用者發布的文字、圖片或檔案保有片面修改或移除的權利。當使用者使用本網站留言服務時，表示已詳細閱讀並完全了解，且同意配合下述規定：違反上述規定者，中時新聞網有權刪除留言，或者直接封鎖帳號！請使用者在發言前，務必先閱讀留言板規則，謝謝配合。,blue
綠放話監委明表決 在野批違憲,為反對包含陳菊在內的監察院人事案，國民黨占領立院議場今將進入第三天。民進黨立院黨團總召柯建銘昨表示，國民黨團阻擋審查，正常程序走不下去，「禮拜五勢必一戰（指表決）」。對此，國民黨重申「堅持阻擋最不恰當的監委名單」；民眾黨則強調，強行投票程序不完備，違法又違憲，呼籲蔡英文總統停止提名作業。立法院原訂周二起審查監察院長被提名人陳菊、監委被提名人的人事案，但因國民黨團認為陳菊等人不適任，發動占領議場，期間一度與民進黨團爆發流血衝突，讓審查會喊卡。但依議程規畫明天就將進入表決。國民黨團總召林為洲表示，前監察院長王建煊、張博雅，當初被提名時都已離開政壇一陣子，且至少監院沒他們的案子，但陳菊就是有，包括私菸案、氣爆案、慶富案，如果陳菊當院長將來怎麼處理？林為洲也說，被提名人葉宜津先前才參加民進黨立委初選失利，現在因被提名監委就說超越黨派，這是把人民當白癡？誰會相信？看到就生氣，這樣也可以？柯建銘回應，透過質詢「把陳菊問倒才是王道」，但國民黨看來會持續占領，禮拜五勢必一戰。然而，若未經審查就表決，是否有違程序？他強調，是國民黨團阻擋審查，責任歸屬很清楚，不應歸咎被提名人，若沒辦法走正常程序，當然就是決戰禮拜五了。對此，民眾黨團副總召張其祿質疑，依立法院職權行使法規定，程序必須經全院委員會審查、投票，若少了審查會程序，投票強行通過，會有違法違憲問題，呼籲蔡總統建立好的憲政慣例，馬上停止提名作業。中時新聞網對留言系統使用者發布的文字、圖片或檔案保有片面修改或移除的權利。當使用者使用本網站留言服務時，表示已詳細閱讀並完全了解，且同意配合下述規定：違反上述規定者，中時新聞網有權刪除留言，或者直接封鎖帳號！請使用者在發言前，務必先閱讀留言板規則，謝謝配合。,blue
聲援吳怡玎 洪秀柱批7男立委喪心病狂,國民黨前主席洪秀柱昨天深夜在臉書發文，聲援國民黨立委為監委名單強力抗爭，並指名年輕女立委吳怡玎竟被張宏陸、蔡易餘、沈發惠、蘇震清、邱志偉、吳秉叡以及陳柏惟等7位民進黨、基進黨男立委包圍、動粗，可知民進黨為追逐利益，已到喪心病狂的程度。曾在2010年在立法院議事衝突中，被民進黨立委蘇震清跨站頭部的洪秀柱說，民進黨堅持提名陳菊這樣一位極具爭議的監察院長，監察委員的名單更是荒腔走板，不僅有政治色彩鮮明的前立委、黨產會主委林峯正的哥哥，還有接受陳情彈劾「曲棍球案」檢察官的蔡崇義與高涌誠…。她說，這樣的人事任命，無疑是將「應獨立行使職權」的監察院當作派系分贓的酬庸，本就該接受民意的監督！國民黨在立院雖然席次較少，但仍受民意的託付，一個在市長任內被監察院糾正30次的人，竟可擔任監察院長，台灣民眾絕對無法接受！洪秀柱指出，對抗「吃銅吃鐵吃國家」的民進黨，國民黨在人數上是絕對的劣勢，但在明知條件不足的情況下，國民黨黨立委能夠不怯戰、不畏戰，我們認為「敢戰即是贏」！或許戰略、戰術上還須更加精進，外界對國民黨也還有些不同的批評，然而面對民進黨貪婪的惡狀，仍堅持對抗到最後，希望大家能夠給予國民黨立委一些鼓勵。她強調，尤其在立法院內，國民黨的年輕女立委吳怡玎竟被張宏陸、蔡易餘、沈發惠、蘇震清、邱志偉、吳秉叡以及陳柏惟等7位男立委包圍、動粗，可知民進黨為追逐利益，已經到了如此喪心病狂的程度！替國民黨立委加油，希望他們能堅持下去，繼續加強與民眾溝通，相信人民一定會理解，我們正在替中華民國最高監察機關守住它的尊嚴！(中時 )中時新聞網對留言系統使用者發布的文字、圖片或檔案保有片面修改或移除的權利。當使用者使用本網站留言服務時，表示已詳細閱讀並完全了解，且同意配合下述規定：違反上述規定者，中時新聞網有權刪除留言，或者直接封鎖帳號！請使用者在發言前，務必先閱讀留言板規則，謝謝配合。,blue
綠啟動議場清除 陳玉珍萬夫莫敵抵抗中,朱真楷／台北報導立法院臨時會明將表決監察院人事案，面對國民黨團佔領議場，民進黨團在今天下午四點左右發動清除行動，將黨團分男、女兩支隊伍，分別鎖定國民黨男、女立委，以優勢人力，嘗試一個一個從主席台拖走，再架到議場後方驅哩，雙方目前仍僵持不下，但民進黨團預計傍晚前就要將議場清除完畢。立法院臨時會原訂周二起審查監察院長被提名人陳菊、監委被提名人的人事案，但因國民黨團認為陳菊等人不適任，發動占領議場，今天已經進入第三天。期間民眾黨也出面表態讚聲，讓審查因而喊卡迄今，但依臨時會議程，明天仍將進入表決。為讓陳菊等被提名人的表決案在明天順利通過，民進黨團在今天下午4點左右，進入議場發動清場行動。國民黨團為穩住主席台這塊陣地，讓來自戰地金門、性格剽悍的黨籍立委陳玉珍負責壓陣的工作，為了被抓傷，陳玉珍在國民黨POLO衫之內，特別穿上一件粉紅色的自行車衣，頭上則帶著自行車的安全帽，整個過程緊緊主席台上的麥克風，要為國民黨留下持續抗爭的一線活路。果然，在民進黨發動清場工作後，原先圍繞在陳玉珍身邊的黨籍同志，包括先前在朱立倫帶領下特訓拳擊的洪孟楷，也都在不到10分鐘左右的時間，就在身形粗壯的綠營立委蔡易餘、蘇震清等人的拖拉下，一個一個全被「抓」、「架」、「推」的攻勢下，全被逐出場外。眼見陳玉珍頭也不抬，甚至一度將臉緊貼著主席台，抵死不擾的戰力讓黨籍男同志都很不捨，賴士葆就立刻找來大聲公，高喊「放開你們的鹹豬手！」偶爾民進黨團幹事長鄭運鵬嘗試拉住陳玉珍，也立刻被賴士葆喝斥「男生不要摸女生！」截至目前為止，雙方仍在對峙中。(中時 )中時新聞網對留言系統使用者發布的文字、圖片或檔案保有片面修改或移除的權利。當使用者使用本網站留言服務時，表示已詳細閱讀並完全了解，且同意配合下述規定：違反上述規定者，中時新聞網有權刪除留言，或者直接封鎖帳號！請使用者在發言前，務必先閱讀留言板規則，謝謝配合。,blue
遭控性騷擾 陳雪生無奈：我肚子長鐵釘嗎？,為阻擋監察院長被提名人陳菊及監委人事同意案，國民黨立委占領議場卻衍伸性騷擾風波，被民進黨立委范雲指控的國民黨立委陳雪生（左）16日再喊冤，表示自己一點意圖、犯意、行動動作都沒有，「我肚子長鐵釘嗎？奇怪欸！」並無奈地說，以後打架男女分流比較好，碰在一起都有事。(中時 )中時新聞網對留言系統使用者發布的文字、圖片或檔案保有片面修改或移除的權利。當使用者使用本網站留言服務時，表示已詳細閱讀並完全了解，且同意配合下述規定：違反上述規定者，中時新聞網有權刪除留言，或者直接封鎖帳號！請使用者在發言前，務必先閱讀留言板規則，謝謝配合。,blue
